Orthogroup	Species Tree Node	Gene Tree Node	Support	Type	Genes 1	Genes 2
OG0000002	N0	n0	1.0	Non-Terminal	MFC_MF11_proteins_WP_160603260.1, MFC_MF18_proteins_WP_160584060.1, MFC_MF22_proteins_WP_160584060.1, MFC_ATCC27716_proteins_WP_002557696.1, MFC_MF33_proteins_WP_002557696.1, MFC_Ms42_proteins_WP_002557696.1, MFC_MF30_proteins_WP_160605434.1, MFC_MF29_proteins_WP_160581434.1, MFC_ATCC27716_proteins_WP_002557507.1, MFC_Ms42_proteins_WP_002557507.1, MFC_MF30_proteins_WP_160605454.1, MHP_MHP650_proteins_WP_258556677.1, MHP_MHP679_proteins_WP_160585200.1, MHP_MHP691_proteins_WP_160585200.1, MHP_MHP699_proteins_WP_160585200.1, MHP_7422_proteins_WP_020835748.1, MHP_7448_proteins_WP_020835748.1, MHP_Ue273_proteins_WP_020835748.1, MHP_168L_proteins_WP_228365382.1, MHP_168_proteins_WP_228365382.1, MHP_TB1_proteins_WP_228365382.1, MHP_11_proteins_WP_011206236.1, MHP_232_proteins_WP_011206236.1, MHP_NCTC10127_proteins_WP_011206236.1, MHP_KM014_proteins_WP_011284160.1, MHP_116_proteins_WP_237697200.1, MHP_98_proteins_WP_237697200.1, MHP_ES2_proteins_WP_237697200.1, MHP_J_proteins_WP_237697200.1, MHP_UFV01_proteins_WP_237697200.1, MHP_UFV02_proteins_WP_237697200.1, MHP_MHP682_proteins_WP_258555846.1, MHP_LH_proteins_WP_233688429.1, MHP_MHP653_proteins_WP_258555957.1, MHP_1257_proteins_WP_348571662.1, MHP_111A_proteins_WP_225972974.1, MHP_112B_proteins_WP_225972974.1, MHP_131B_proteins_WP_225972974.1, MHP_133A_proteins_WP_225972974.1, MHP_F72C_proteins_WP_225972974.1, MHP_153B_proteins_WP_258555377.1, MHP_154B_proteins_WP_258555377.1, MHP_4284_proteins_WP_258555377.1, MHP_MHP694_proteins_WP_258555377.1, MHP_MHP696_proteins_WP_258555377.1, MHP_MHP709_proteins_WP_258555377.1, MHP_ES2L_proteins_WP_218833877.1, MHP_4284_proteins_WP_160606963.1, MHP_MHP694_proteins_WP_160606963.1, MHP_153B_proteins_WP_404923949.1, MHP_154B_proteins_WP_404923949.1, MHP_168L_proteins_WP_011206235.1, MHP_7422_proteins_WP_011206235.1, MHP_7448_proteins_WP_011206235.1, MHP_KM014_proteins_WP_011206235.1, MHP_NCTC10127_proteins_WP_011206235.1, MHP_Ue273_proteins_WP_011206235.1, MHP_MHP653_proteins_WP_160615875.1, MHP_MHP696_proteins_WP_160615875.1, MHP_131B_proteins_WP_404924222.1, MHP_133A_proteins_WP_404924222.1, MHP_LH_proteins_WP_160588366.1, MHP_MHP709_proteins_WP_160588366.1, MHP_98_proteins_WP_160585767.1, MHP_J_proteins_WP_160585767.1, MHP_MHP682_proteins_WP_160585767.1, MHP_ES2_proteins_WP_081430767.1, MHP_UFV01_proteins_WP_081430767.1, MHP_UFV02_proteins_WP_081430767.1, MHP_MHP650_proteins_WP_160601116.1, MHP_111A_proteins_WP_146379587.1, MHP_112B_proteins_WP_146379587.1, MHP_F72C_proteins_WP_146379587.1, MHP_153B_proteins_WP_404923948.1, MHP_11_proteins_WP_158209055.1, MHP_168_proteins_WP_158209055.1, MHP_232_proteins_WP_158209055.1, MHP_TB1_proteins_WP_158209055.1, MFC_MF18_proteins_WP_160593471.1, MFC_MF22_proteins_WP_160583997.1	MFC_MF33_proteins_WP_160609360.1, MFC_MF30_proteins_WP_160605643.1, MFC_MF11_proteins_WP_308705398.1, MFC_MF18_proteins_WP_160593459.1, MFC_MF22_proteins_WP_160584066.1, MFC_MF22_proteins_WP_160583931.1, MFC_MF29_proteins_WP_308704653.1, MFC_MF30_proteins_WP_160605504.1, MHP_F72C_proteins_WP_225973022.1, MFC_MF18_proteins_WP_160593538.1, MHP_J_proteins_WP_011284152.1, MHP_MHP699_proteins_WP_160585311.1, MHP_F72C_proteins_WP_225973021.1, MHP_MHP691_proteins_WP_160608106.1, MHP_MHP679_proteins_WP_160590513.1, MHP_153B_proteins_WP_404923934.1, MHP_154B_proteins_WP_404923934.1, MHP_111A_proteins_WP_404912241.1, MHP_112B_proteins_WP_404913718.1, MHP_MHP696_proteins_WP_160588356.1, MHP_MHP709_proteins_WP_160588356.1, MHP_MHP653_proteins_WP_160615955.1, MHP_MHP682_proteins_WP_160585824.1, MHP_LH_proteins_WP_233688422.1, MHP_1257_proteins_WP_348571681.1, MHP_4284_proteins_WP_406823109.1, MHP_ES2_proteins_WP_135618870.1, MFC_MF33_proteins_WP_160609436.1, MHP_MHP650_proteins_WP_160601263.1, MHP_131B_proteins_WP_404924509.1, MHP_133A_proteins_WP_404924213.1, MHP_116_proteins_WP_348602505.1, MHP_ES2L_proteins_WP_179221136.1, MFC_MF11_proteins_WP_160603252.1, MFC_MF29_proteins_WP_160581489.1, MHP_7422_proteins_WP_020835737.1, MHP_UFV01_proteins_WP_243216173.1, MHP_UFV02_proteins_WP_243216173.1, MFC_ATCC27716_proteins_WP_002557987.1, MFC_MF22_proteins_WP_002557987.1, MFC_Ms42_proteins_WP_002557987.1, MHP_MHP691_proteins_WP_160608118.1, MHP_MHP696_proteins_WP_160588193.1, MHP_MHP709_proteins_WP_160588193.1, MHP_MHP694_proteins_WP_160606941.1, MHP_4284_proteins_WP_406823273.1, MHP_MHP653_proteins_WP_160615941.1, MHP_KM014_proteins_WP_094521652.1, MHP_ES2L_proteins_WP_179221108.1, MHP_MHP650_proteins_WP_160601022.1, MHP_98_proteins_WP_179696125.1, MHP_131B_proteins_WP_404924467.1, MHP_133A_proteins_WP_404924467.1, MHP_7422_proteins_WP_020835682.1, MHP_7448_proteins_WP_020835682.1, MHP_MHP699_proteins_WP_160585042.1, MFC_MF29_proteins_WP_160581136.1, MFC_ATCC27716_proteins_WP_002557503.1, MFC_Ms42_proteins_WP_002557503.1, MFC_MF30_proteins_WP_160605578.1, MFC_MF11_proteins_WP_160603138.1, MFC_MF18_proteins_WP_160583787.1, MFC_MF22_proteins_WP_160583787.1, MFC_MF33_proteins_WP_160609402.1, MHP_Ue273_proteins_WP_347952457.1, MHP_116_proteins_WP_348602818.1, MHP_153B_proteins_WP_404924158.1, MHP_154B_proteins_WP_404924158.1, MHP_1257_proteins_WP_348572102.1, MHP_MHP679_proteins_WP_160585690.1, MHP_MHP682_proteins_WP_160585690.1, MHP_F72C_proteins_WP_146379583.1, MHP_ES2_proteins_WP_135618787.1, MHP_11_proteins_WP_011206167.1, MHP_232_proteins_WP_011206167.1, MHP_NCTC10127_proteins_WP_011206167.1, MHP_UFV01_proteins_WP_243216098.1, MHP_UFV02_proteins_WP_243216098.1, MHP_LH_proteins_WP_233688740.1, MHP_J_proteins_WP_011284083.1, MHP_168L_proteins_WP_014579753.1, MHP_TB1_proteins_WP_014579753.1, MHP_168_proteins_WP_014579748.1, MHP_168_proteins_WP_014579753.1
OG0000002	N0	n1	0.11363636363636363	Non-Terminal	MFC_MF11_proteins_WP_160603260.1, MFC_MF18_proteins_WP_160584060.1, MFC_MF22_proteins_WP_160584060.1, MFC_ATCC27716_proteins_WP_002557696.1, MFC_MF33_proteins_WP_002557696.1, MFC_Ms42_proteins_WP_002557696.1, MFC_MF30_proteins_WP_160605434.1, MFC_MF29_proteins_WP_160581434.1	MFC_ATCC27716_proteins_WP_002557507.1, MFC_Ms42_proteins_WP_002557507.1, MFC_MF30_proteins_WP_160605454.1, MHP_MHP650_proteins_WP_258556677.1, MHP_MHP679_proteins_WP_160585200.1, MHP_MHP691_proteins_WP_160585200.1, MHP_MHP699_proteins_WP_160585200.1, MHP_7422_proteins_WP_020835748.1, MHP_7448_proteins_WP_020835748.1, MHP_Ue273_proteins_WP_020835748.1, MHP_168L_proteins_WP_228365382.1, MHP_168_proteins_WP_228365382.1, MHP_TB1_proteins_WP_228365382.1, MHP_11_proteins_WP_011206236.1, MHP_232_proteins_WP_011206236.1, MHP_NCTC10127_proteins_WP_011206236.1, MHP_KM014_proteins_WP_011284160.1, MHP_116_proteins_WP_237697200.1, MHP_98_proteins_WP_237697200.1, MHP_ES2_proteins_WP_237697200.1, MHP_J_proteins_WP_237697200.1, MHP_UFV01_proteins_WP_237697200.1, MHP_UFV02_proteins_WP_237697200.1, MHP_MHP682_proteins_WP_258555846.1, MHP_LH_proteins_WP_233688429.1, MHP_MHP653_proteins_WP_258555957.1, MHP_1257_proteins_WP_348571662.1, MHP_111A_proteins_WP_225972974.1, MHP_112B_proteins_WP_225972974.1, MHP_131B_proteins_WP_225972974.1, MHP_133A_proteins_WP_225972974.1, MHP_F72C_proteins_WP_225972974.1, MHP_153B_proteins_WP_258555377.1, MHP_154B_proteins_WP_258555377.1, MHP_4284_proteins_WP_258555377.1, MHP_MHP694_proteins_WP_258555377.1, MHP_MHP696_proteins_WP_258555377.1, MHP_MHP709_proteins_WP_258555377.1, MHP_ES2L_proteins_WP_218833877.1, MHP_4284_proteins_WP_160606963.1, MHP_MHP694_proteins_WP_160606963.1, MHP_153B_proteins_WP_404923949.1, MHP_154B_proteins_WP_404923949.1, MHP_168L_proteins_WP_011206235.1, MHP_7422_proteins_WP_011206235.1, MHP_7448_proteins_WP_011206235.1, MHP_KM014_proteins_WP_011206235.1, MHP_NCTC10127_proteins_WP_011206235.1, MHP_Ue273_proteins_WP_011206235.1, MHP_MHP653_proteins_WP_160615875.1, MHP_MHP696_proteins_WP_160615875.1, MHP_131B_proteins_WP_404924222.1, MHP_133A_proteins_WP_404924222.1, MHP_LH_proteins_WP_160588366.1, MHP_MHP709_proteins_WP_160588366.1, MHP_98_proteins_WP_160585767.1, MHP_J_proteins_WP_160585767.1, MHP_MHP682_proteins_WP_160585767.1, MHP_ES2_proteins_WP_081430767.1, MHP_UFV01_proteins_WP_081430767.1, MHP_UFV02_proteins_WP_081430767.1, MHP_MHP650_proteins_WP_160601116.1, MHP_111A_proteins_WP_146379587.1, MHP_112B_proteins_WP_146379587.1, MHP_F72C_proteins_WP_146379587.1, MHP_153B_proteins_WP_404923948.1, MHP_11_proteins_WP_158209055.1, MHP_168_proteins_WP_158209055.1, MHP_232_proteins_WP_158209055.1, MHP_TB1_proteins_WP_158209055.1, MFC_MF18_proteins_WP_160593471.1, MFC_MF22_proteins_WP_160583997.1
OG0000002	N0	n11	0.4772727272727273	Non-Terminal	MHP_MHP650_proteins_WP_258556677.1, MHP_MHP679_proteins_WP_160585200.1, MHP_MHP691_proteins_WP_160585200.1, MHP_MHP699_proteins_WP_160585200.1, MHP_7422_proteins_WP_020835748.1, MHP_7448_proteins_WP_020835748.1, MHP_Ue273_proteins_WP_020835748.1, MHP_168L_proteins_WP_228365382.1, MHP_168_proteins_WP_228365382.1, MHP_TB1_proteins_WP_228365382.1, MHP_11_proteins_WP_011206236.1, MHP_232_proteins_WP_011206236.1, MHP_NCTC10127_proteins_WP_011206236.1, MHP_KM014_proteins_WP_011284160.1, MHP_116_proteins_WP_237697200.1, MHP_98_proteins_WP_237697200.1, MHP_ES2_proteins_WP_237697200.1, MHP_J_proteins_WP_237697200.1, MHP_UFV01_proteins_WP_237697200.1, MHP_UFV02_proteins_WP_237697200.1, MHP_MHP682_proteins_WP_258555846.1, MHP_LH_proteins_WP_233688429.1, MHP_MHP653_proteins_WP_258555957.1, MHP_1257_proteins_WP_348571662.1, MHP_111A_proteins_WP_225972974.1, MHP_112B_proteins_WP_225972974.1, MHP_131B_proteins_WP_225972974.1, MHP_133A_proteins_WP_225972974.1, MHP_F72C_proteins_WP_225972974.1, MHP_153B_proteins_WP_258555377.1, MHP_154B_proteins_WP_258555377.1, MHP_4284_proteins_WP_258555377.1, MHP_MHP694_proteins_WP_258555377.1, MHP_MHP696_proteins_WP_258555377.1, MHP_MHP709_proteins_WP_258555377.1, MHP_ES2L_proteins_WP_218833877.1, MHP_4284_proteins_WP_160606963.1, MHP_MHP694_proteins_WP_160606963.1, MHP_153B_proteins_WP_404923949.1, MHP_154B_proteins_WP_404923949.1, MHP_168L_proteins_WP_011206235.1, MHP_7422_proteins_WP_011206235.1, MHP_7448_proteins_WP_011206235.1, MHP_KM014_proteins_WP_011206235.1, MHP_NCTC10127_proteins_WP_011206235.1, MHP_Ue273_proteins_WP_011206235.1	MHP_MHP653_proteins_WP_160615875.1, MHP_MHP696_proteins_WP_160615875.1, MHP_131B_proteins_WP_404924222.1, MHP_133A_proteins_WP_404924222.1, MHP_LH_proteins_WP_160588366.1, MHP_MHP709_proteins_WP_160588366.1, MHP_98_proteins_WP_160585767.1, MHP_J_proteins_WP_160585767.1, MHP_MHP682_proteins_WP_160585767.1, MHP_ES2_proteins_WP_081430767.1, MHP_UFV01_proteins_WP_081430767.1, MHP_UFV02_proteins_WP_081430767.1, MHP_MHP650_proteins_WP_160601116.1, MHP_111A_proteins_WP_146379587.1, MHP_112B_proteins_WP_146379587.1, MHP_F72C_proteins_WP_146379587.1, MHP_153B_proteins_WP_404923948.1, MHP_11_proteins_WP_158209055.1, MHP_168_proteins_WP_158209055.1, MHP_232_proteins_WP_158209055.1, MHP_TB1_proteins_WP_158209055.1, MFC_MF18_proteins_WP_160593471.1, MFC_MF22_proteins_WP_160583997.1
OG0000002	N0	n15	0.22727272727272727	Non-Terminal	MHP_7422_proteins_WP_020835748.1, MHP_7448_proteins_WP_020835748.1, MHP_Ue273_proteins_WP_020835748.1, MHP_168L_proteins_WP_228365382.1, MHP_168_proteins_WP_228365382.1, MHP_TB1_proteins_WP_228365382.1, MHP_11_proteins_WP_011206236.1, MHP_232_proteins_WP_011206236.1, MHP_NCTC10127_proteins_WP_011206236.1, MHP_KM014_proteins_WP_011284160.1, MHP_116_proteins_WP_237697200.1, MHP_98_proteins_WP_237697200.1, MHP_ES2_proteins_WP_237697200.1, MHP_J_proteins_WP_237697200.1, MHP_UFV01_proteins_WP_237697200.1, MHP_UFV02_proteins_WP_237697200.1, MHP_MHP682_proteins_WP_258555846.1, MHP_LH_proteins_WP_233688429.1, MHP_MHP653_proteins_WP_258555957.1, MHP_1257_proteins_WP_348571662.1, MHP_111A_proteins_WP_225972974.1, MHP_112B_proteins_WP_225972974.1, MHP_131B_proteins_WP_225972974.1, MHP_133A_proteins_WP_225972974.1, MHP_F72C_proteins_WP_225972974.1, MHP_153B_proteins_WP_258555377.1, MHP_154B_proteins_WP_258555377.1, MHP_4284_proteins_WP_258555377.1, MHP_MHP694_proteins_WP_258555377.1, MHP_MHP696_proteins_WP_258555377.1, MHP_MHP709_proteins_WP_258555377.1	MHP_ES2L_proteins_WP_218833877.1, MHP_4284_proteins_WP_160606963.1, MHP_MHP694_proteins_WP_160606963.1, MHP_153B_proteins_WP_404923949.1, MHP_154B_proteins_WP_404923949.1, MHP_168L_proteins_WP_011206235.1, MHP_7422_proteins_WP_011206235.1, MHP_7448_proteins_WP_011206235.1, MHP_KM014_proteins_WP_011206235.1, MHP_NCTC10127_proteins_WP_011206235.1, MHP_Ue273_proteins_WP_011206235.1
OG0000002	N0	n55	0.13636363636363635	Non-Terminal	MFC_MF33_proteins_WP_160609360.1, MFC_MF30_proteins_WP_160605643.1, MFC_MF11_proteins_WP_308705398.1, MFC_MF18_proteins_WP_160593459.1, MFC_MF22_proteins_WP_160584066.1, MFC_MF22_proteins_WP_160583931.1, MFC_MF29_proteins_WP_308704653.1, MFC_MF30_proteins_WP_160605504.1	MHP_F72C_proteins_WP_225973022.1, MFC_MF18_proteins_WP_160593538.1, MHP_J_proteins_WP_011284152.1, MHP_MHP699_proteins_WP_160585311.1, MHP_F72C_proteins_WP_225973021.1, MHP_MHP691_proteins_WP_160608106.1, MHP_MHP679_proteins_WP_160590513.1, MHP_153B_proteins_WP_404923934.1, MHP_154B_proteins_WP_404923934.1, MHP_111A_proteins_WP_404912241.1, MHP_112B_proteins_WP_404913718.1, MHP_MHP696_proteins_WP_160588356.1, MHP_MHP709_proteins_WP_160588356.1, MHP_MHP653_proteins_WP_160615955.1, MHP_MHP682_proteins_WP_160585824.1, MHP_LH_proteins_WP_233688422.1, MHP_1257_proteins_WP_348571681.1, MHP_4284_proteins_WP_406823109.1, MHP_ES2_proteins_WP_135618870.1, MFC_MF33_proteins_WP_160609436.1, MHP_MHP650_proteins_WP_160601263.1, MHP_131B_proteins_WP_404924509.1, MHP_133A_proteins_WP_404924213.1, MHP_116_proteins_WP_348602505.1, MHP_ES2L_proteins_WP_179221136.1, MFC_MF11_proteins_WP_160603252.1, MFC_MF29_proteins_WP_160581489.1, MHP_7422_proteins_WP_020835737.1, MHP_UFV01_proteins_WP_243216173.1, MHP_UFV02_proteins_WP_243216173.1, MFC_ATCC27716_proteins_WP_002557987.1, MFC_MF22_proteins_WP_002557987.1, MFC_Ms42_proteins_WP_002557987.1, MHP_MHP691_proteins_WP_160608118.1, MHP_MHP696_proteins_WP_160588193.1, MHP_MHP709_proteins_WP_160588193.1, MHP_MHP694_proteins_WP_160606941.1, MHP_4284_proteins_WP_406823273.1, MHP_MHP653_proteins_WP_160615941.1, MHP_KM014_proteins_WP_094521652.1, MHP_ES2L_proteins_WP_179221108.1, MHP_MHP650_proteins_WP_160601022.1, MHP_98_proteins_WP_179696125.1, MHP_131B_proteins_WP_404924467.1, MHP_133A_proteins_WP_404924467.1, MHP_7422_proteins_WP_020835682.1, MHP_7448_proteins_WP_020835682.1, MHP_MHP699_proteins_WP_160585042.1, MFC_MF29_proteins_WP_160581136.1, MFC_ATCC27716_proteins_WP_002557503.1, MFC_Ms42_proteins_WP_002557503.1, MFC_MF30_proteins_WP_160605578.1, MFC_MF11_proteins_WP_160603138.1, MFC_MF18_proteins_WP_160583787.1, MFC_MF22_proteins_WP_160583787.1, MFC_MF33_proteins_WP_160609402.1, MHP_Ue273_proteins_WP_347952457.1, MHP_116_proteins_WP_348602818.1, MHP_153B_proteins_WP_404924158.1, MHP_154B_proteins_WP_404924158.1, MHP_1257_proteins_WP_348572102.1, MHP_MHP679_proteins_WP_160585690.1, MHP_MHP682_proteins_WP_160585690.1, MHP_F72C_proteins_WP_146379583.1, MHP_ES2_proteins_WP_135618787.1, MHP_11_proteins_WP_011206167.1, MHP_232_proteins_WP_011206167.1, MHP_NCTC10127_proteins_WP_011206167.1, MHP_UFV01_proteins_WP_243216098.1, MHP_UFV02_proteins_WP_243216098.1, MHP_LH_proteins_WP_233688740.1, MHP_J_proteins_WP_011284083.1, MHP_168L_proteins_WP_014579753.1, MHP_TB1_proteins_WP_014579753.1, MHP_168_proteins_WP_014579748.1, MHP_168_proteins_WP_014579753.1
OG0000002	N34	n56	0.125	Non-Terminal	MFC_MF33_proteins_WP_160609360.1, MFC_MF30_proteins_WP_160605643.1, MFC_MF11_proteins_WP_308705398.1, MFC_MF18_proteins_WP_160593459.1, MFC_MF22_proteins_WP_160584066.1, MFC_MF22_proteins_WP_160583931.1, MFC_MF29_proteins_WP_308704653.1	MFC_MF30_proteins_WP_160605504.1
OG0000002	MFC_MF22_proteins	n62	1.0	Terminal	MFC_MF22_proteins_WP_160584066.1	MFC_MF22_proteins_WP_160583931.1
OG0000002	N0	n63	0.6818181818181818	Non-Terminal	MHP_F72C_proteins_WP_225973022.1, MFC_MF18_proteins_WP_160593538.1, MHP_J_proteins_WP_011284152.1, MHP_MHP699_proteins_WP_160585311.1, MHP_F72C_proteins_WP_225973021.1, MHP_MHP691_proteins_WP_160608106.1, MHP_MHP679_proteins_WP_160590513.1, MHP_153B_proteins_WP_404923934.1, MHP_154B_proteins_WP_404923934.1, MHP_111A_proteins_WP_404912241.1, MHP_112B_proteins_WP_404913718.1, MHP_MHP696_proteins_WP_160588356.1, MHP_MHP709_proteins_WP_160588356.1, MHP_MHP653_proteins_WP_160615955.1, MHP_MHP682_proteins_WP_160585824.1, MHP_LH_proteins_WP_233688422.1, MHP_1257_proteins_WP_348571681.1, MHP_4284_proteins_WP_406823109.1, MHP_ES2_proteins_WP_135618870.1, MFC_MF33_proteins_WP_160609436.1, MHP_MHP650_proteins_WP_160601263.1, MHP_131B_proteins_WP_404924509.1, MHP_133A_proteins_WP_404924213.1, MHP_116_proteins_WP_348602505.1, MHP_ES2L_proteins_WP_179221136.1, MFC_MF11_proteins_WP_160603252.1, MFC_MF29_proteins_WP_160581489.1, MHP_7422_proteins_WP_020835737.1, MHP_UFV01_proteins_WP_243216173.1, MHP_UFV02_proteins_WP_243216173.1, MFC_ATCC27716_proteins_WP_002557987.1, MFC_MF22_proteins_WP_002557987.1, MFC_Ms42_proteins_WP_002557987.1	MHP_MHP691_proteins_WP_160608118.1, MHP_MHP696_proteins_WP_160588193.1, MHP_MHP709_proteins_WP_160588193.1, MHP_MHP694_proteins_WP_160606941.1, MHP_4284_proteins_WP_406823273.1, MHP_MHP653_proteins_WP_160615941.1, MHP_KM014_proteins_WP_094521652.1, MHP_ES2L_proteins_WP_179221108.1, MHP_MHP650_proteins_WP_160601022.1, MHP_98_proteins_WP_179696125.1, MHP_131B_proteins_WP_404924467.1, MHP_133A_proteins_WP_404924467.1, MHP_7422_proteins_WP_020835682.1, MHP_7448_proteins_WP_020835682.1, MHP_MHP699_proteins_WP_160585042.1, MFC_MF29_proteins_WP_160581136.1, MFC_ATCC27716_proteins_WP_002557503.1, MFC_Ms42_proteins_WP_002557503.1, MFC_MF30_proteins_WP_160605578.1, MFC_MF11_proteins_WP_160603138.1, MFC_MF18_proteins_WP_160583787.1, MFC_MF22_proteins_WP_160583787.1, MFC_MF33_proteins_WP_160609402.1, MHP_Ue273_proteins_WP_347952457.1, MHP_116_proteins_WP_348602818.1, MHP_153B_proteins_WP_404924158.1, MHP_154B_proteins_WP_404924158.1, MHP_1257_proteins_WP_348572102.1, MHP_MHP679_proteins_WP_160585690.1, MHP_MHP682_proteins_WP_160585690.1, MHP_F72C_proteins_WP_146379583.1, MHP_ES2_proteins_WP_135618787.1, MHP_11_proteins_WP_011206167.1, MHP_232_proteins_WP_011206167.1, MHP_NCTC10127_proteins_WP_011206167.1, MHP_UFV01_proteins_WP_243216098.1, MHP_UFV02_proteins_WP_243216098.1, MHP_LH_proteins_WP_233688740.1, MHP_J_proteins_WP_011284083.1, MHP_168L_proteins_WP_014579753.1, MHP_TB1_proteins_WP_014579753.1, MHP_168_proteins_WP_014579748.1, MHP_168_proteins_WP_014579753.1
OG0000002	N0	n64	0.022727272727272728	Non-Terminal	MHP_F72C_proteins_WP_225973022.1	MFC_MF18_proteins_WP_160593538.1, MHP_J_proteins_WP_011284152.1, MHP_MHP699_proteins_WP_160585311.1, MHP_F72C_proteins_WP_225973021.1, MHP_MHP691_proteins_WP_160608106.1, MHP_MHP679_proteins_WP_160590513.1, MHP_153B_proteins_WP_404923934.1, MHP_154B_proteins_WP_404923934.1, MHP_111A_proteins_WP_404912241.1, MHP_112B_proteins_WP_404913718.1, MHP_MHP696_proteins_WP_160588356.1, MHP_MHP709_proteins_WP_160588356.1, MHP_MHP653_proteins_WP_160615955.1, MHP_MHP682_proteins_WP_160585824.1, MHP_LH_proteins_WP_233688422.1, MHP_1257_proteins_WP_348571681.1, MHP_4284_proteins_WP_406823109.1, MHP_ES2_proteins_WP_135618870.1, MFC_MF33_proteins_WP_160609436.1, MHP_MHP650_proteins_WP_160601263.1, MHP_131B_proteins_WP_404924509.1, MHP_133A_proteins_WP_404924213.1, MHP_116_proteins_WP_348602505.1, MHP_ES2L_proteins_WP_179221136.1, MFC_MF11_proteins_WP_160603252.1, MFC_MF29_proteins_WP_160581489.1, MHP_7422_proteins_WP_020835737.1, MHP_UFV01_proteins_WP_243216173.1, MHP_UFV02_proteins_WP_243216173.1, MFC_ATCC27716_proteins_WP_002557987.1, MFC_MF22_proteins_WP_002557987.1, MFC_Ms42_proteins_WP_002557987.1
OG0000002	MHP_168_proteins	n134	1.0	Terminal	MHP_168_proteins_WP_014579748.1	MHP_168_proteins_WP_014579753.1
OG0000003	N0	n0	0.7727272727272727	Non-Terminal	MHP_KM014_proteins_WP_094521572.1, MHP_131B_proteins_WP_404924470.1, MHP_133A_proteins_WP_404924470.1, MHP_11_proteins_WP_044284791.1, MHP_232_proteins_WP_044284791.1, MHP_NCTC10127_proteins_WP_044284791.1, MHP_Ue273_proteins_WP_347952373.1, MHP_131B_proteins_WP_404924388.1, MHP_133A_proteins_WP_404924388.1, MHP_111A_proteins_WP_404912467.1, MHP_112B_proteins_WP_404912467.1, MHP_4284_proteins_WP_406823224.1, MHP_154B_proteins_WP_404924623.1, MHP_98_proteins_WP_258556536.1, MHP_116_proteins_WP_348602823.1, MHP_MHP653_proteins_WP_160615984.1, MHP_11_proteins_WP_044284785.1, MHP_232_proteins_WP_044284785.1, MHP_NCTC10127_proteins_WP_044284785.1, MHP_MHP679_proteins_WP_160590073.1, MHP_116_proteins_WP_348602702.1, MHP_ES2_proteins_WP_135618540.1, MHP_MHP679_proteins_WP_160590541.1, MHP_111A_proteins_WP_404912175.1, MHP_112B_proteins_WP_404912175.1, MHP_168L_proteins_WP_014579780.1, MHP_168_proteins_WP_014579780.1, MHP_MHP650_proteins_WP_220200909.1, MHP_Ue273_proteins_WP_347952462.1, MHP_MHP709_proteins_WP_160587869.1, MHP_ES2_proteins_WP_135618795.1, MHP_MHP696_proteins_WP_135618795.1, MHP_J_proteins_WP_044284634.1, MHP_LH_proteins_WP_233688742.1, MHP_UFV01_proteins_WP_233688742.1, MHP_UFV02_proteins_WP_233688742.1, MHP_4284_proteins_WP_406823275.1, MHP_98_proteins_WP_179696110.1, MHP_7422_proteins_WP_041361639.1, MHP_168L_proteins_WP_014579584.1, MHP_168_proteins_WP_014579584.1, MHP_TB1_proteins_WP_252862215.1, MHP_J_proteins_WP_044284583.1, MHP_LH_proteins_WP_233688628.1, MHP_UFV01_proteins_WP_243215969.1, MHP_UFV02_proteins_WP_243215969.1, MHP_1257_proteins_WP_348572110.1, MHP_ES2_proteins_WP_135618807.1, MHP_MHP653_proteins_WP_160615980.1, MHP_Ue273_proteins_WP_347952470.1, MHP_MHP653_proteins_WP_160615982.1, MHP_MHP682_proteins_WP_220191211.1, MHP_MHP691_proteins_WP_160607882.1, MHP_MHP699_proteins_WP_220190744.1, MHP_ES2L_proteins_WP_044272440.1, MHP_153B_proteins_WP_404924160.1, MHP_154B_proteins_WP_404924622.1, MHP_F72C_proteins_WP_146379620.1, MHP_7448_proteins_WP_044272444.1, MHP_MHP694_proteins_WP_160606452.1, MHP_98_proteins_WP_258556590.1, MHP_153B_proteins_WP_146379482.1, MHP_154B_proteins_WP_146379482.1, MHP_F72C_proteins_WP_146379482.1, MHP_7448_proteins_WP_044272440.1, MHP_7448_proteins_WP_044272308.1	MHP_7448_proteins_WP_052269171.1, MHP_Ue273_proteins_WP_347952393.1, MHP_MHP691_proteins_WP_308704686.1, MHP_ES2_proteins_WP_135618606.1, MHP_MHP699_proteins_WP_160584822.1, MHP_MHP682_proteins_WP_160585822.1, MHP_MHP691_proteins_WP_258555606.1, MHP_111A_proteins_WP_225973018.1, MHP_112B_proteins_WP_225973018.1, MHP_F72C_proteins_WP_225973018.1, MHP_131B_proteins_WP_404923944.1, MHP_133A_proteins_WP_404923944.1, MHP_153B_proteins_WP_404923944.1, MHP_154B_proteins_WP_404923944.1, MHP_1257_proteins_WP_348571976.1, MHP_MHP653_proteins_WP_160615810.1, MHP_111A_proteins_WP_225973019.1, MHP_112B_proteins_WP_225973019.1, MHP_F72C_proteins_WP_225973019.1, MHP_J_proteins_WP_237697197.1, MHP_ES2_proteins_WP_240536309.1, MHP_MHP696_proteins_WP_240536309.1, MHP_MHP709_proteins_WP_240536309.1, MHP_ES2L_proteins_WP_240536590.1, MHP_MHP653_proteins_WP_240536590.1, MHP_MHP679_proteins_WP_240536590.1, MHP_MHP691_proteins_WP_240536590.1, MHP_MHP699_proteins_WP_240536590.1, MHP_116_proteins_WP_348602509.1, MHP_MHP691_proteins_WP_308704693.1, MHP_7422_proteins_WP_041361653.1, MHP_MHP682_proteins_WP_160585818.1, MHP_MHP653_proteins_WP_308506998.1, MHP_MHP679_proteins_WP_308506998.1, MHP_MHP699_proteins_WP_308506998.1, MHP_111A_proteins_WP_225973026.1, MHP_112B_proteins_WP_225973026.1, MHP_F72C_proteins_WP_225973026.1, MFC_ATCC27716_proteins_WP_039387603.1, MFC_Ms42_proteins_WP_039387603.1, MFC_MF11_proteins_WP_160603254.1, MFC_MF29_proteins_WP_160581478.1, MHP_111A_proteins_WP_225973025.1, MHP_112B_proteins_WP_225973025.1, MHP_F72C_proteins_WP_225973025.1, MFC_MF18_proteins_WP_160584042.1, MFC_MF22_proteins_WP_160584042.1, MHP_ES2_proteins_WP_237697199.1, MHP_J_proteins_WP_237697199.1, MHP_MHP650_proteins_WP_237697199.1, MFC_MF33_proteins_WP_258556794.1, MHP_LH_proteins_WP_233688427.1, MHP_ES2L_proteins_WP_240536589.1, MHP_1257_proteins_WP_348571667.1, MHP_4284_proteins_WP_406823104.1, MHP_MHP696_proteins_WP_308507067.1, MHP_MHP709_proteins_WP_308507067.1, MHP_UFV01_proteins_WP_243216179.1, MHP_UFV02_proteins_WP_243216179.1, MFC_MF33_proteins_WP_308704745.1, MHP_MHP650_proteins_WP_308704766.1, MHP_J_proteins_WP_237697198.1, MHP_ES2_proteins_WP_240536310.1, MHP_LH_proteins_WP_233688750.1, MHP_116_proteins_WP_094521666.1, MHP_KM014_proteins_WP_094521666.1, MHP_131B_proteins_WP_404924565.1, MHP_F72C_proteins_WP_192894277.1, MHP_MHP653_proteins_WP_192894277.1, MHP_MHP679_proteins_WP_192894277.1, MHP_MHP682_proteins_WP_192894277.1, MHP_MHP699_proteins_WP_192894277.1, MHP_Ue273_proteins_WP_192894277.1, MHP_MHP650_proteins_WP_220200875.1, MHP_UFV02_proteins_WP_243234971.1, MHP_133A_proteins_WP_052259119.1, MHP_98_proteins_WP_052259119.1, MHP_ES2L_proteins_WP_240536655.1, MHP_J_proteins_WP_148166899.1, MHP_11_proteins_WP_187145846.1, MHP_232_proteins_WP_187145846.1, MHP_168L_proteins_WP_052293597.1, MHP_168_proteins_WP_052293597.1, MHP_MHP696_proteins_WP_052293597.1, MHP_MHP709_proteins_WP_052293597.1, MHP_TB1_proteins_WP_052293597.1, MHP_7422_proteins_WP_051129928.1, MHP_133A_proteins_WP_404924478.1, MHP_111A_proteins_WP_179696107.1, MHP_112B_proteins_WP_179696107.1, MHP_98_proteins_WP_179696107.1, MHP_4284_proteins_WP_406823281.1, MHP_1257_proteins_WP_348572120.1, MHP_153B_proteins_WP_404924172.1, MHP_154B_proteins_WP_404924172.1, MHP_ES2_proteins_WP_228729174.1
