Orthogroup	Species Tree Node	Gene Tree Node	Support	Type	Genes 1	Genes 2
OG0000007	N2	n53	0.023809523809523808	Non-Terminal	MHP_MHP691_proteins_WP_258555628.1	MHP_J_proteins_WP_044284652.1, MHP_112B_proteins_WP_404913724.1, MHP_MHP653_proteins_WP_160615975.1, MHP_1257_proteins_WP_348571672.1, MHP_MHP691_proteins_WP_258555629.1
OG0000008	N0	n0	0.7272727272727273	Non-Terminal	MHP_116_proteins_WP_348602523.1, MHP_KM014_proteins_WP_094521776.1, MHP_UFV01_proteins_WP_243216199.1, MHP_UFV02_proteins_WP_243216199.1, MHP_J_proteins_WP_011284180.1, MHP_LH_proteins_WP_233688439.1, MHP_111A_proteins_WP_404911847.1, MHP_112B_proteins_WP_404911847.1, MHP_7422_proteins_WP_020835760.1, MHP_7448_proteins_WP_011290229.1, MHP_F72C_proteins_WP_011290229.1, MHP_131B_proteins_WP_404924227.1, MHP_133A_proteins_WP_404924227.1, MHP_ES2L_proteins_WP_240536593.1, MHP_1257_proteins_WP_179696025.1, MHP_98_proteins_WP_179696025.1, MHP_4284_proteins_WP_406823102.1, MHP_153B_proteins_WP_404923955.1, MHP_154B_proteins_WP_404923955.1, MHP_168L_proteins_WP_016340224.1, MHP_168_proteins_WP_014579856.1, MHP_TB1_proteins_WP_088764629.1, MHP_232_proteins_WP_232039538.1, MHP_NCTC10127_proteins_WP_232039538.1, MHP_11_proteins_WP_241499462.1, MHP_ES2_proteins_WP_240536315.1, MHP_11_proteins_WP_011206260.1, MHP_232_proteins_WP_011206260.1, MHP_ES2L_proteins_WP_011206260.1, MHP_ES2_proteins_WP_011206260.1, MHP_MHP650_proteins_WP_011206260.1, MHP_NCTC10127_proteins_WP_011206260.1, MHP_Ue273_proteins_WP_347952220.1, MHP_7448_proteins_WP_148174328.1, MHP_F72C_proteins_WP_225973033.1, MHP_MHP679_proteins_WP_258555683.1, MHP_154B_proteins_WP_404924619.1, MHP_133A_proteins_WP_404924455.1, MHP_ES2_proteins_WP_240536388.1, MHP_UFV01_proteins_WP_243216076.1, MHP_UFV02_proteins_WP_243234963.1, MHP_1257_proteins_WP_348572086.1, MHP_116_proteins_WP_348602804.1, MHP_133A_proteins_WP_404924456.1, MHP_111A_proteins_WP_404912369.1, MHP_112B_proteins_WP_404912369.1, MHP_LH_proteins_WP_233688729.1, MHP_4284_proteins_WP_406823264.1, MHP_7422_proteins_WP_041361617.1, MFC_MF29_proteins_WP_220200574.1, MFC_ATCC27716_proteins_WP_051054298.1, MFC_Ms42_proteins_WP_236681789.1, MFC_MF11_proteins_WP_220190829.1, MHP_232_proteins_WP_011206151.1, MHP_NCTC10127_proteins_WP_011206151.1, MHP_168L_proteins_WP_014579768.1, MHP_168_proteins_WP_014579768.1, MHP_TB1_proteins_WP_252862201.1, MHP_ES2L_proteins_WP_240536647.1, MHP_J_proteins_WP_237697238.1, MHP_MHP694_proteins_WP_258555464.1, MFC_MF33_proteins_WP_220190046.1, MHP_131B_proteins_WP_404924560.1, MHP_7448_proteins_WP_044272707.1, MHP_MHP699_proteins_WP_220190685.1, MHP_MHP696_proteins_WP_258555379.1, MHP_MHP709_proteins_WP_258555379.1, MHP_153B_proteins_WP_404924145.1, MHP_154B_proteins_WP_404924145.1, MHP_153B_proteins_WP_404924146.1, MHP_154B_proteins_WP_404924620.1	MHP_UFV01_proteins_WP_243216238.1, MHP_UFV02_proteins_WP_243216238.1, MHP_LH_proteins_WP_233688470.1, MHP_J_proteins_WP_237697210.1, MHP_116_proteins_WP_348602544.1, MHP_MHP691_proteins_WP_258555633.1, MHP_4284_proteins_WP_406823131.1, MHP_MHP653_proteins_WP_258555965.1, MHP_7422_proteins_WP_228366102.1, MHP_7448_proteins_WP_228366102.1, MHP_131B_proteins_WP_404924495.1, MHP_133A_proteins_WP_404924495.1, MHP_153B_proteins_WP_404924196.1, MHP_154B_proteins_WP_404924196.1, MHP_Ue273_proteins_WP_347952490.1, MHP_98_proteins_WP_258556542.1, MHP_11_proteins_WP_241499463.1, MHP_232_proteins_WP_011206295.1, MHP_NCTC10127_proteins_WP_011206295.1, MHP_111A_proteins_WP_404911900.1, MHP_112B_proteins_WP_404911900.1, MHP_ES2_proteins_WP_240536339.1, MHP_MHP679_proteins_WP_160590314.1, MHP_ES2_proteins_WP_240536338.1, MHP_111A_proteins_WP_404911898.1, MHP_112B_proteins_WP_404911898.1, MHP_168L_proteins_WP_233417351.1, MHP_168_proteins_WP_014579887.1, MHP_TB1_proteins_WP_252862214.1, MHP_MHP682_proteins_WP_308507018.1, MHP_1257_proteins_WP_348572153.1, MHP_MHP699_proteins_WP_280996809.1, MHP_MHP694_proteins_WP_308704614.1, MHP_MHP650_proteins_WP_258556714.1, MHP_ES2L_proteins_WP_225972989.1, MHP_F72C_proteins_WP_225972989.1, MHP_MHP696_proteins_WP_308507071.1, MHP_MHP709_proteins_WP_308507071.1
OG0000008	N0	n1	0.5227272727272727	Non-Terminal	MHP_116_proteins_WP_348602523.1, MHP_KM014_proteins_WP_094521776.1, MHP_UFV01_proteins_WP_243216199.1, MHP_UFV02_proteins_WP_243216199.1, MHP_J_proteins_WP_011284180.1, MHP_LH_proteins_WP_233688439.1, MHP_111A_proteins_WP_404911847.1, MHP_112B_proteins_WP_404911847.1, MHP_7422_proteins_WP_020835760.1, MHP_7448_proteins_WP_011290229.1, MHP_F72C_proteins_WP_011290229.1, MHP_131B_proteins_WP_404924227.1, MHP_133A_proteins_WP_404924227.1, MHP_ES2L_proteins_WP_240536593.1, MHP_1257_proteins_WP_179696025.1, MHP_98_proteins_WP_179696025.1, MHP_4284_proteins_WP_406823102.1, MHP_153B_proteins_WP_404923955.1, MHP_154B_proteins_WP_404923955.1, MHP_168L_proteins_WP_016340224.1, MHP_168_proteins_WP_014579856.1, MHP_TB1_proteins_WP_088764629.1, MHP_232_proteins_WP_232039538.1, MHP_NCTC10127_proteins_WP_232039538.1, MHP_11_proteins_WP_241499462.1, MHP_ES2_proteins_WP_240536315.1, MHP_11_proteins_WP_011206260.1, MHP_232_proteins_WP_011206260.1, MHP_ES2L_proteins_WP_011206260.1, MHP_ES2_proteins_WP_011206260.1, MHP_MHP650_proteins_WP_011206260.1, MHP_NCTC10127_proteins_WP_011206260.1, MHP_Ue273_proteins_WP_347952220.1	MHP_7448_proteins_WP_148174328.1, MHP_F72C_proteins_WP_225973033.1, MHP_MHP679_proteins_WP_258555683.1, MHP_154B_proteins_WP_404924619.1, MHP_133A_proteins_WP_404924455.1, MHP_ES2_proteins_WP_240536388.1, MHP_UFV01_proteins_WP_243216076.1, MHP_UFV02_proteins_WP_243234963.1, MHP_1257_proteins_WP_348572086.1, MHP_116_proteins_WP_348602804.1, MHP_133A_proteins_WP_404924456.1, MHP_111A_proteins_WP_404912369.1, MHP_112B_proteins_WP_404912369.1, MHP_LH_proteins_WP_233688729.1, MHP_4284_proteins_WP_406823264.1, MHP_7422_proteins_WP_041361617.1, MFC_MF29_proteins_WP_220200574.1, MFC_ATCC27716_proteins_WP_051054298.1, MFC_Ms42_proteins_WP_236681789.1, MFC_MF11_proteins_WP_220190829.1, MHP_232_proteins_WP_011206151.1, MHP_NCTC10127_proteins_WP_011206151.1, MHP_168L_proteins_WP_014579768.1, MHP_168_proteins_WP_014579768.1, MHP_TB1_proteins_WP_252862201.1, MHP_ES2L_proteins_WP_240536647.1, MHP_J_proteins_WP_237697238.1, MHP_MHP694_proteins_WP_258555464.1, MFC_MF33_proteins_WP_220190046.1, MHP_131B_proteins_WP_404924560.1, MHP_7448_proteins_WP_044272707.1, MHP_MHP699_proteins_WP_220190685.1, MHP_MHP696_proteins_WP_258555379.1, MHP_MHP709_proteins_WP_258555379.1, MHP_153B_proteins_WP_404924145.1, MHP_154B_proteins_WP_404924145.1, MHP_153B_proteins_WP_404924146.1, MHP_154B_proteins_WP_404924620.1
OG0000008	N23	n25	0.14285714285714285	Non-Terminal	MHP_232_proteins_WP_232039538.1, MHP_NCTC10127_proteins_WP_232039538.1, MHP_11_proteins_WP_241499462.1	MHP_ES2_proteins_WP_240536315.1, MHP_11_proteins_WP_011206260.1, MHP_232_proteins_WP_011206260.1, MHP_ES2L_proteins_WP_011206260.1, MHP_ES2_proteins_WP_011206260.1, MHP_MHP650_proteins_WP_011206260.1, MHP_NCTC10127_proteins_WP_011206260.1
OG0000008	N23	n28	0.047619047619047616	Non-Terminal	MHP_ES2_proteins_WP_240536315.1	MHP_11_proteins_WP_011206260.1, MHP_232_proteins_WP_011206260.1, MHP_ES2L_proteins_WP_011206260.1, MHP_ES2_proteins_WP_011206260.1, MHP_MHP650_proteins_WP_011206260.1, MHP_NCTC10127_proteins_WP_011206260.1
OG0000008	N0	n30	0.022727272727272728	Non-Terminal	MHP_7448_proteins_WP_148174328.1	MHP_F72C_proteins_WP_225973033.1, MHP_MHP679_proteins_WP_258555683.1, MHP_154B_proteins_WP_404924619.1, MHP_133A_proteins_WP_404924455.1, MHP_ES2_proteins_WP_240536388.1, MHP_UFV01_proteins_WP_243216076.1, MHP_UFV02_proteins_WP_243234963.1, MHP_1257_proteins_WP_348572086.1, MHP_116_proteins_WP_348602804.1, MHP_133A_proteins_WP_404924456.1, MHP_111A_proteins_WP_404912369.1, MHP_112B_proteins_WP_404912369.1, MHP_LH_proteins_WP_233688729.1, MHP_4284_proteins_WP_406823264.1, MHP_7422_proteins_WP_041361617.1, MFC_MF29_proteins_WP_220200574.1, MFC_ATCC27716_proteins_WP_051054298.1, MFC_Ms42_proteins_WP_236681789.1, MFC_MF11_proteins_WP_220190829.1, MHP_232_proteins_WP_011206151.1, MHP_NCTC10127_proteins_WP_011206151.1, MHP_168L_proteins_WP_014579768.1, MHP_168_proteins_WP_014579768.1, MHP_TB1_proteins_WP_252862201.1, MHP_ES2L_proteins_WP_240536647.1, MHP_J_proteins_WP_237697238.1, MHP_MHP694_proteins_WP_258555464.1, MFC_MF33_proteins_WP_220190046.1, MHP_131B_proteins_WP_404924560.1, MHP_7448_proteins_WP_044272707.1, MHP_MHP699_proteins_WP_220190685.1, MHP_MHP696_proteins_WP_258555379.1, MHP_MHP709_proteins_WP_258555379.1, MHP_153B_proteins_WP_404924145.1, MHP_154B_proteins_WP_404924145.1, MHP_153B_proteins_WP_404924146.1, MHP_154B_proteins_WP_404924620.1
OG0000008	N0	n33	0.045454545454545456	Non-Terminal	MHP_154B_proteins_WP_404924619.1, MHP_133A_proteins_WP_404924455.1	MHP_ES2_proteins_WP_240536388.1, MHP_UFV01_proteins_WP_243216076.1, MHP_UFV02_proteins_WP_243234963.1, MHP_1257_proteins_WP_348572086.1, MHP_116_proteins_WP_348602804.1, MHP_133A_proteins_WP_404924456.1, MHP_111A_proteins_WP_404912369.1, MHP_112B_proteins_WP_404912369.1, MHP_LH_proteins_WP_233688729.1, MHP_4284_proteins_WP_406823264.1, MHP_7422_proteins_WP_041361617.1, MFC_MF29_proteins_WP_220200574.1, MFC_ATCC27716_proteins_WP_051054298.1, MFC_Ms42_proteins_WP_236681789.1, MFC_MF11_proteins_WP_220190829.1, MHP_232_proteins_WP_011206151.1, MHP_NCTC10127_proteins_WP_011206151.1, MHP_168L_proteins_WP_014579768.1, MHP_168_proteins_WP_014579768.1, MHP_TB1_proteins_WP_252862201.1, MHP_ES2L_proteins_WP_240536647.1, MHP_J_proteins_WP_237697238.1, MHP_MHP694_proteins_WP_258555464.1, MFC_MF33_proteins_WP_220190046.1, MHP_131B_proteins_WP_404924560.1, MHP_7448_proteins_WP_044272707.1, MHP_MHP699_proteins_WP_220190685.1, MHP_MHP696_proteins_WP_258555379.1, MHP_MHP709_proteins_WP_258555379.1, MHP_153B_proteins_WP_404924145.1, MHP_154B_proteins_WP_404924145.1, MHP_153B_proteins_WP_404924146.1, MHP_154B_proteins_WP_404924620.1
OG0000008	N15	n64	1.0	Non-Terminal	MHP_153B_proteins_WP_404924145.1, MHP_154B_proteins_WP_404924145.1	MHP_153B_proteins_WP_404924146.1, MHP_154B_proteins_WP_404924620.1
OG0000008	N0	n86	0.06818181818181818	Non-Terminal	MHP_111A_proteins_WP_404911900.1, MHP_112B_proteins_WP_404911900.1, MHP_ES2_proteins_WP_240536339.1	MHP_MHP679_proteins_WP_160590314.1, MHP_ES2_proteins_WP_240536338.1, MHP_111A_proteins_WP_404911898.1, MHP_112B_proteins_WP_404911898.1, MHP_168L_proteins_WP_233417351.1, MHP_168_proteins_WP_014579887.1, MHP_TB1_proteins_WP_252862214.1, MHP_MHP682_proteins_WP_308507018.1, MHP_1257_proteins_WP_348572153.1, MHP_MHP699_proteins_WP_280996809.1, MHP_MHP694_proteins_WP_308704614.1, MHP_MHP650_proteins_WP_258556714.1, MHP_ES2L_proteins_WP_225972989.1, MHP_F72C_proteins_WP_225972989.1, MHP_MHP696_proteins_WP_308507071.1, MHP_MHP709_proteins_WP_308507071.1
OG0000009	N0	n0	0.7272727272727273	Non-Terminal	MHP_131B_proteins_WP_404924404.1, MHP_133A_proteins_WP_404924404.1, MHP_112B_proteins_WP_041361566.1, MHP_1257_proteins_WP_041361566.1, MHP_153B_proteins_WP_041361566.1, MHP_154B_proteins_WP_041361566.1, MHP_7422_proteins_WP_041361566.1, MHP_Ue273_proteins_WP_041361566.1, MHP_111A_proteins_WP_404912199.1, MHP_116_proteins_WP_348602749.1, MHP_MHP650_proteins_WP_160600866.1, MHP_232_proteins_WP_011206100.1, MHP_98_proteins_WP_011206100.1, MHP_ES2_proteins_WP_011206100.1, MHP_J_proteins_WP_011206100.1, MHP_NCTC10127_proteins_WP_011206100.1, MHP_UFV01_proteins_WP_011206100.1, MHP_UFV02_proteins_WP_011206100.1, MHP_111A_proteins_WP_404912201.1, MHP_168L_proteins_WP_014579653.1, MHP_168_proteins_WP_014579653.1, MHP_TB1_proteins_WP_252862193.1, MHP_7448_proteins_WP_011290018.1, MHP_116_proteins_WP_348602671.1, MHP_11_proteins_WP_011205856.1, MHP_232_proteins_WP_011205856.1, MHP_NCTC10127_proteins_WP_011205856.1, MHP_111A_proteins_WP_041361519.1, MHP_112B_proteins_WP_041361519.1, MHP_1257_proteins_WP_041361519.1, MHP_131B_proteins_WP_041361519.1, MHP_133A_proteins_WP_041361519.1, MHP_153B_proteins_WP_041361519.1, MHP_154B_proteins_WP_041361519.1, MHP_7422_proteins_WP_041361519.1, MHP_7448_proteins_WP_041361519.1, MHP_98_proteins_WP_041361519.1, MHP_MHP691_proteins_WP_041361519.1, MHP_Ue273_proteins_WP_041361519.1, MHP_KM014_proteins_WP_094521537.1, MHP_LH_proteins_WP_094521537.1, MHP_MHP650_proteins_WP_094521537.1, MHP_MHP694_proteins_WP_160606899.1, MHP_4284_proteins_WP_146379448.1, MHP_F72C_proteins_WP_146379448.1, MHP_MHP653_proteins_WP_146379448.1, MHP_MHP682_proteins_WP_146379448.1, MHP_MHP696_proteins_WP_146379448.1, MHP_MHP709_proteins_WP_146379448.1, MHP_ES2_proteins_WP_135618648.1, MHP_MHP653_proteins_WP_160584690.1, MHP_MHP682_proteins_WP_160584690.1, MHP_MHP699_proteins_WP_160584690.1, MHP_116_proteins_WP_348602762.1, MHP_MHP650_proteins_WP_258556653.1, MHP_MHP679_proteins_WP_258555704.1, MHP_J_proteins_WP_237697232.1, MHP_11_proteins_WP_232039583.1, MHP_232_proteins_WP_232039583.1, MHP_NCTC10127_proteins_WP_232039583.1, MHP_UFV01_proteins_WP_232039583.1, MHP_UFV02_proteins_WP_232039583.1, MHP_1257_proteins_WP_348572028.1, MHP_LH_proteins_WP_233688691.1	MHP_4284_proteins_WP_146379497.1, MHP_F72C_proteins_WP_146379497.1, MHP_UFV01_proteins_WP_243215989.1, MHP_UFV02_proteins_WP_243215989.1, MHP_MHP699_proteins_WP_160584797.1, MHP_116_proteins_WP_348602747.1, MHP_111A_proteins_WP_011290021.1, MHP_112B_proteins_WP_011290021.1, MHP_1257_proteins_WP_011290021.1, MHP_131B_proteins_WP_011290021.1, MHP_133A_proteins_WP_011290021.1, MHP_153B_proteins_WP_011290021.1, MHP_154B_proteins_WP_011290021.1, MHP_7422_proteins_WP_011290021.1, MHP_7448_proteins_WP_011290021.1, MHP_MHP694_proteins_WP_011290021.1, MHP_MHP696_proteins_WP_011290021.1, MHP_MHP709_proteins_WP_011290021.1, MHP_Ue273_proteins_WP_011290021.1, MHP_ES2_proteins_WP_135618567.1, MHP_KM014_proteins_WP_094521581.1, MHP_MHP650_proteins_WP_094521581.1, MHP_MHP682_proteins_WP_160585618.1, MHP_11_proteins_WP_088172535.1, MHP_J_proteins_WP_011283921.1, MHP_98_proteins_WP_179695839.1, MHP_ES2L_proteins_WP_179221024.1, MHP_LH_proteins_WP_179221024.1, MHP_168L_proteins_WP_233417359.1, MHP_168_proteins_WP_228365411.1, MHP_TB1_proteins_WP_016340194.1, MHP_232_proteins_WP_011206098.1, MHP_NCTC10127_proteins_WP_011206098.1, MHP_168L_proteins_WP_233417360.1, MHP_116_proteins_WP_348602748.1
OG0000009	N0	n1	0.4318181818181818	Non-Terminal	MHP_131B_proteins_WP_404924404.1, MHP_133A_proteins_WP_404924404.1, MHP_112B_proteins_WP_041361566.1, MHP_1257_proteins_WP_041361566.1, MHP_153B_proteins_WP_041361566.1, MHP_154B_proteins_WP_041361566.1, MHP_7422_proteins_WP_041361566.1, MHP_Ue273_proteins_WP_041361566.1, MHP_111A_proteins_WP_404912199.1, MHP_116_proteins_WP_348602749.1, MHP_MHP650_proteins_WP_160600866.1, MHP_232_proteins_WP_011206100.1, MHP_98_proteins_WP_011206100.1, MHP_ES2_proteins_WP_011206100.1, MHP_J_proteins_WP_011206100.1, MHP_NCTC10127_proteins_WP_011206100.1, MHP_UFV01_proteins_WP_011206100.1, MHP_UFV02_proteins_WP_011206100.1, MHP_111A_proteins_WP_404912201.1, MHP_168L_proteins_WP_014579653.1, MHP_168_proteins_WP_014579653.1, MHP_TB1_proteins_WP_252862193.1, MHP_7448_proteins_WP_011290018.1	MHP_116_proteins_WP_348602671.1, MHP_11_proteins_WP_011205856.1, MHP_232_proteins_WP_011205856.1, MHP_NCTC10127_proteins_WP_011205856.1, MHP_111A_proteins_WP_041361519.1, MHP_112B_proteins_WP_041361519.1, MHP_1257_proteins_WP_041361519.1, MHP_131B_proteins_WP_041361519.1, MHP_133A_proteins_WP_041361519.1, MHP_153B_proteins_WP_041361519.1, MHP_154B_proteins_WP_041361519.1, MHP_7422_proteins_WP_041361519.1, MHP_7448_proteins_WP_041361519.1, MHP_98_proteins_WP_041361519.1, MHP_MHP691_proteins_WP_041361519.1, MHP_Ue273_proteins_WP_041361519.1, MHP_KM014_proteins_WP_094521537.1, MHP_LH_proteins_WP_094521537.1, MHP_MHP650_proteins_WP_094521537.1, MHP_MHP694_proteins_WP_160606899.1, MHP_4284_proteins_WP_146379448.1, MHP_F72C_proteins_WP_146379448.1, MHP_MHP653_proteins_WP_146379448.1, MHP_MHP682_proteins_WP_146379448.1, MHP_MHP696_proteins_WP_146379448.1, MHP_MHP709_proteins_WP_146379448.1, MHP_ES2_proteins_WP_135618648.1, MHP_MHP653_proteins_WP_160584690.1, MHP_MHP682_proteins_WP_160584690.1, MHP_MHP699_proteins_WP_160584690.1, MHP_116_proteins_WP_348602762.1, MHP_MHP650_proteins_WP_258556653.1, MHP_MHP679_proteins_WP_258555704.1, MHP_J_proteins_WP_237697232.1, MHP_11_proteins_WP_232039583.1, MHP_232_proteins_WP_232039583.1, MHP_NCTC10127_proteins_WP_232039583.1, MHP_UFV01_proteins_WP_232039583.1, MHP_UFV02_proteins_WP_232039583.1, MHP_1257_proteins_WP_348572028.1, MHP_LH_proteins_WP_233688691.1
OG0000009	N2	n7	0.023809523809523808	Non-Terminal	MHP_111A_proteins_WP_404912199.1	MHP_116_proteins_WP_348602749.1, MHP_MHP650_proteins_WP_160600866.1, MHP_232_proteins_WP_011206100.1, MHP_98_proteins_WP_011206100.1, MHP_ES2_proteins_WP_011206100.1, MHP_J_proteins_WP_011206100.1, MHP_NCTC10127_proteins_WP_011206100.1, MHP_UFV01_proteins_WP_011206100.1, MHP_UFV02_proteins_WP_011206100.1, MHP_111A_proteins_WP_404912201.1, MHP_168L_proteins_WP_014579653.1, MHP_168_proteins_WP_014579653.1, MHP_TB1_proteins_WP_252862193.1
OG0000009	N0	n15	0.20454545454545456	Non-Terminal	MHP_116_proteins_WP_348602671.1, MHP_11_proteins_WP_011205856.1, MHP_232_proteins_WP_011205856.1, MHP_NCTC10127_proteins_WP_011205856.1, MHP_111A_proteins_WP_041361519.1, MHP_112B_proteins_WP_041361519.1, MHP_1257_proteins_WP_041361519.1, MHP_131B_proteins_WP_041361519.1, MHP_133A_proteins_WP_041361519.1, MHP_153B_proteins_WP_041361519.1, MHP_154B_proteins_WP_041361519.1, MHP_7422_proteins_WP_041361519.1, MHP_7448_proteins_WP_041361519.1, MHP_98_proteins_WP_041361519.1, MHP_MHP691_proteins_WP_041361519.1, MHP_Ue273_proteins_WP_041361519.1, MHP_KM014_proteins_WP_094521537.1, MHP_LH_proteins_WP_094521537.1, MHP_MHP650_proteins_WP_094521537.1, MHP_MHP694_proteins_WP_160606899.1, MHP_4284_proteins_WP_146379448.1, MHP_F72C_proteins_WP_146379448.1, MHP_MHP653_proteins_WP_146379448.1, MHP_MHP682_proteins_WP_146379448.1, MHP_MHP696_proteins_WP_146379448.1, MHP_MHP709_proteins_WP_146379448.1	MHP_ES2_proteins_WP_135618648.1, MHP_MHP653_proteins_WP_160584690.1, MHP_MHP682_proteins_WP_160584690.1, MHP_MHP699_proteins_WP_160584690.1, MHP_116_proteins_WP_348602762.1, MHP_MHP650_proteins_WP_258556653.1, MHP_MHP679_proteins_WP_258555704.1, MHP_J_proteins_WP_237697232.1, MHP_11_proteins_WP_232039583.1, MHP_232_proteins_WP_232039583.1, MHP_NCTC10127_proteins_WP_232039583.1, MHP_UFV01_proteins_WP_232039583.1, MHP_UFV02_proteins_WP_232039583.1, MHP_1257_proteins_WP_348572028.1, MHP_LH_proteins_WP_233688691.1
OG0000009	N0	n37	0.045454545454545456	Non-Terminal	MHP_UFV01_proteins_WP_243215989.1, MHP_UFV02_proteins_WP_243215989.1, MHP_MHP699_proteins_WP_160584797.1, MHP_116_proteins_WP_348602747.1, MHP_111A_proteins_WP_011290021.1, MHP_112B_proteins_WP_011290021.1, MHP_1257_proteins_WP_011290021.1, MHP_131B_proteins_WP_011290021.1, MHP_133A_proteins_WP_011290021.1, MHP_153B_proteins_WP_011290021.1, MHP_154B_proteins_WP_011290021.1, MHP_7422_proteins_WP_011290021.1, MHP_7448_proteins_WP_011290021.1, MHP_MHP694_proteins_WP_011290021.1, MHP_MHP696_proteins_WP_011290021.1, MHP_MHP709_proteins_WP_011290021.1, MHP_Ue273_proteins_WP_011290021.1, MHP_ES2_proteins_WP_135618567.1, MHP_KM014_proteins_WP_094521581.1, MHP_MHP650_proteins_WP_094521581.1, MHP_MHP682_proteins_WP_160585618.1, MHP_11_proteins_WP_088172535.1, MHP_J_proteins_WP_011283921.1, MHP_98_proteins_WP_179695839.1, MHP_ES2L_proteins_WP_179221024.1, MHP_LH_proteins_WP_179221024.1, MHP_168L_proteins_WP_233417359.1, MHP_168_proteins_WP_228365411.1, MHP_TB1_proteins_WP_016340194.1, MHP_232_proteins_WP_011206098.1, MHP_NCTC10127_proteins_WP_011206098.1	MHP_168L_proteins_WP_233417360.1, MHP_116_proteins_WP_348602748.1
OG0000010	N0	n2	0.5909090909090909	Non-Terminal	MHP_Ue273_proteins_WP_347952475.1, MHP_MHP679_proteins_WP_160590099.1, MHP_MHP682_proteins_WP_160585752.1, MHP_MHP696_proteins_WP_160587884.1, MHP_MHP709_proteins_WP_160587884.1, MHP_UFV01_proteins_WP_243216127.1, MHP_UFV02_proteins_WP_243216127.1, MHP_J_proteins_WP_011284107.1, MHP_MHP650_proteins_WP_160601055.1, MHP_7448_proteins_WP_011290178.1, MHP_7422_proteins_WP_020835701.1, MHP_MHP691_proteins_WP_160607876.1, MHP_F72C_proteins_WP_146379615.1, MHP_168L_proteins_WP_014579794.1, MHP_168_proteins_WP_014579794.1, MHP_TB1_proteins_WP_014579794.1, MHP_ES2_proteins_WP_135618816.1, MHP_116_proteins_WP_348602833.1, MHP_11_proteins_WP_011206187.1, MHP_232_proteins_WP_011206187.1, MHP_NCTC10127_proteins_WP_011206187.1, MHP_MHP699_proteins_WP_160585030.1, MHP_131B_proteins_WP_404924479.1, MHP_133A_proteins_WP_404924479.1, MHP_MHP694_proteins_WP_160606459.1, MHP_1257_proteins_WP_348572122.1, MHP_ES2L_proteins_WP_179221114.1, MHP_LH_proteins_WP_179221114.1, MHP_4284_proteins_WP_406823282.1, MHP_KM014_proteins_WP_094521667.1, MHP_98_proteins_WP_179696106.1, MHP_111A_proteins_WP_404911810.1, MHP_112B_proteins_WP_404911810.1, MHP_MHP653_proteins_WP_160615540.1	MHP_J_proteins_WP_237697236.1, MHP_168_proteins_WP_014579743.1, MHP_TB1_proteins_WP_014579743.1, MHP_168L_proteins_WP_016340203.1, MHP_MHP650_proteins_WP_258556703.1, MHP_11_proteins_WP_011205929.1, MHP_232_proteins_WP_011205929.1, MHP_NCTC10127_proteins_WP_011205929.1, MHP_ES2_proteins_WP_240536381.1, MHP_UFV01_proteins_WP_243216067.1, MHP_UFV02_proteins_WP_243216067.1, MHP_98_proteins_WP_308705290.1, MHP_MHP650_proteins_WP_308704767.1, MHP_Ue273_proteins_WP_347952432.1, MHP_J_proteins_WP_237697249.1, MHP_ES2_proteins_WP_240536378.1, MHP_ES2L_proteins_WP_240536640.1, MHP_MHP694_proteins_WP_240536640.1, MHP_11_proteins_WP_011205930.1, MHP_232_proteins_WP_011205930.1, MHP_NCTC10127_proteins_WP_011205930.1, MHP_MHP682_proteins_WP_308506993.1, MHP_MHP699_proteins_WP_308506993.1, MHP_UFV01_proteins_WP_243216066.1, MHP_UFV02_proteins_WP_243216066.1, MHP_MHP694_proteins_WP_258555438.1, MHP_98_proteins_WP_240536641.1, MHP_ES2L_proteins_WP_240536641.1, MHP_MHP682_proteins_WP_240536641.1, MHP_MHP699_proteins_WP_240536641.1, MHP_Ue273_proteins_WP_240536641.1, MHP_MHP699_proteins_WP_160584834.1, MHP_MHP653_proteins_WP_160615836.1, MHP_MHP682_proteins_WP_160585744.1, MHP_MHP709_proteins_WP_160585744.1, MHP_MHP696_proteins_WP_160617513.1, MHP_MHP653_proteins_WP_160615844.1, MHP_MHP682_proteins_WP_160585748.1, MHP_MHP696_proteins_WP_160588333.1, MHP_MHP709_proteins_WP_160588333.1, MHP_7422_proteins_WP_269076334.1, MHP_MHP694_proteins_WP_160606891.1, MHP_168L_proteins_WP_228365400.1, MHP_168_proteins_WP_228365400.1, MHP_J_proteins_WP_228365400.1, MHP_TB1_proteins_WP_228365400.1, MHP_98_proteins_WP_258555487.1, MHP_MHP691_proteins_WP_258555487.1, MHP_MHP694_proteins_WP_258555487.1, MHP_Ue273_proteins_WP_258555487.1, MHP_LH_proteins_WP_233688594.1, MHP_11_proteins_WP_228366119.1, MHP_232_proteins_WP_228366119.1, MHP_7422_proteins_WP_228366119.1, MHP_7448_proteins_WP_228366119.1, MHP_NCTC10127_proteins_WP_228366119.1, MHP_116_proteins_WP_348602673.1, MHP_KM014_proteins_WP_094521538.1, MHP_MHP696_proteins_WP_160588372.1, MHP_MHP709_proteins_WP_160588372.1, MHP_MHP696_proteins_WP_160588382.1, MHP_MHP709_proteins_WP_160588382.1
OG0000010	N0	n34	0.2727272727272727	Non-Terminal	MHP_J_proteins_WP_237697236.1, MHP_168_proteins_WP_014579743.1, MHP_TB1_proteins_WP_014579743.1, MHP_168L_proteins_WP_016340203.1, MHP_MHP650_proteins_WP_258556703.1, MHP_11_proteins_WP_011205929.1, MHP_232_proteins_WP_011205929.1, MHP_NCTC10127_proteins_WP_011205929.1, MHP_ES2_proteins_WP_240536381.1, MHP_UFV01_proteins_WP_243216067.1, MHP_UFV02_proteins_WP_243216067.1, MHP_98_proteins_WP_308705290.1, MHP_MHP650_proteins_WP_308704767.1, MHP_Ue273_proteins_WP_347952432.1, MHP_J_proteins_WP_237697249.1, MHP_ES2_proteins_WP_240536378.1, MHP_ES2L_proteins_WP_240536640.1, MHP_MHP694_proteins_WP_240536640.1, MHP_11_proteins_WP_011205930.1, MHP_232_proteins_WP_011205930.1, MHP_NCTC10127_proteins_WP_011205930.1, MHP_MHP682_proteins_WP_308506993.1, MHP_MHP699_proteins_WP_308506993.1, MHP_UFV01_proteins_WP_243216066.1, MHP_UFV02_proteins_WP_243216066.1, MHP_MHP694_proteins_WP_258555438.1, MHP_98_proteins_WP_240536641.1, MHP_ES2L_proteins_WP_240536641.1, MHP_MHP682_proteins_WP_240536641.1, MHP_MHP699_proteins_WP_240536641.1, MHP_Ue273_proteins_WP_240536641.1	MHP_MHP699_proteins_WP_160584834.1, MHP_MHP653_proteins_WP_160615836.1, MHP_MHP682_proteins_WP_160585744.1, MHP_MHP709_proteins_WP_160585744.1, MHP_MHP696_proteins_WP_160617513.1, MHP_MHP653_proteins_WP_160615844.1, MHP_MHP682_proteins_WP_160585748.1, MHP_MHP696_proteins_WP_160588333.1, MHP_MHP709_proteins_WP_160588333.1, MHP_7422_proteins_WP_269076334.1, MHP_MHP694_proteins_WP_160606891.1, MHP_168L_proteins_WP_228365400.1, MHP_168_proteins_WP_228365400.1, MHP_J_proteins_WP_228365400.1, MHP_TB1_proteins_WP_228365400.1, MHP_98_proteins_WP_258555487.1, MHP_MHP691_proteins_WP_258555487.1, MHP_MHP694_proteins_WP_258555487.1, MHP_Ue273_proteins_WP_258555487.1, MHP_LH_proteins_WP_233688594.1, MHP_11_proteins_WP_228366119.1, MHP_232_proteins_WP_228366119.1, MHP_7422_proteins_WP_228366119.1, MHP_7448_proteins_WP_228366119.1, MHP_NCTC10127_proteins_WP_228366119.1, MHP_116_proteins_WP_348602673.1, MHP_KM014_proteins_WP_094521538.1, MHP_MHP696_proteins_WP_160588372.1, MHP_MHP709_proteins_WP_160588372.1, MHP_MHP696_proteins_WP_160588382.1, MHP_MHP709_proteins_WP_160588382.1
