Orthogroup	Species Tree Node	Gene Tree Node	Support	Type	Genes 1	Genes 2
OG0000000	N0	n0	1.0	Non-Terminal	MHP_MHP650_proteins_WP_160601283.1, MHP_1257_proteins_WP_348572148.1, MHP_153B_proteins_WP_404924195.1, MHP_154B_proteins_WP_404924635.1, MHP_131B_proteins_WP_404924494.1, MHP_133A_proteins_WP_404924494.1, MHP_7448_proteins_WP_228366139.1, MHP_MHP696_proteins_WP_220200970.1, MHP_MHP709_proteins_WP_258555378.1, MFC_MF11_proteins_WP_160603262.1, MFC_MF29_proteins_WP_160581495.1, MFC_MF33_proteins_WP_308704747.1, MFC_ATCC27716_proteins_WP_318023896.1, MFC_Ms42_proteins_WP_318023896.1, MFC_MF30_proteins_WP_308705463.1, MFC_MF22_proteins_WP_308704674.1, MFC_MF18_proteins_WP_220190423.1, MHP_LH_proteins_WP_233688770.1, MHP_NCTC10127_proteins_WP_129640571.1, MHP_11_proteins_WP_202943179.1, MHP_232_proteins_WP_202943179.1, MHP_TB1_proteins_WP_252862191.1, MHP_168L_proteins_WP_318023914.1, MHP_168_proteins_WP_014579837.1, MHP_J_proteins_WP_237697250.1, MHP_UFV01_proteins_WP_243216234.1, MHP_UFV02_proteins_WP_243216234.1, MHP_116_proteins_WP_348602510.1, MHP_ES2_proteins_WP_240536417.1, MHP_MHP653_proteins_WP_308507050.1, MHP_1257_proteins_WP_348571665.1, MHP_4284_proteins_WP_406823103.1, MHP_MHP682_proteins_WP_371807681.1, MHP_MHP650_proteins_WP_160601117.1, MHP_Ue273_proteins_WP_347952487.1, MHP_98_proteins_WP_308705288.1, MHP_112B_proteins_WP_404913768.1, MHP_F72C_proteins_WP_318026087.1, MHP_MHP694_proteins_WP_160606961.1, MHP_4284_proteins_WP_406823094.1, MHP_MHP694_proteins_WP_308704620.1, MFC_MF22_proteins_WP_308704675.1, MFC_MF33_proteins_WP_308704750.1, MHP_7422_proteins_WP_318023952.1, MHP_MHP691_proteins_WP_308704676.1, MFC_MF29_proteins_WP_308704665.1, MFC_MF30_proteins_WP_308705464.1, MFC_MF18_proteins_WP_220190424.1, MFC_Ms42_proteins_WP_236681788.1, MFC_MF30_proteins_WP_220190802.1, MHP_LH_proteins_WP_233688769.1, MFC_ATCC27716_proteins_WP_334199007.1, MFC_MF18_proteins_WP_160593552.1, MFC_MF22_proteins_WP_255454545.1, MHP_MHP699_proteins_WP_160585134.1, MHP_ES2_proteins_WP_135618868.1, MHP_J_proteins_WP_202793361.1, MHP_KM014_proteins_WP_094521687.1, MHP_LH_proteins_WP_233688767.1, MHP_F72C_proteins_WP_225973043.1, MHP_153B_proteins_WP_404924194.1, MHP_154B_proteins_WP_404924634.1, MHP_ES2L_proteins_WP_240536667.1, MHP_ES2L_proteins_WP_240536668.1, MHP_116_proteins_WP_348602860.1, MHP_MHP696_proteins_WP_308507072.1, MHP_MHP709_proteins_WP_308507072.1, MHP_MHP653_proteins_WP_160615959.1, MHP_MHP679_proteins_WP_160590517.1, MHP_116_proteins_WP_348602504.1, MFC_MF22_proteins_WP_039387598.1, MFC_Ms42_proteins_WP_039387598.1, MHP_KM014_proteins_WP_039387598.1, MHP_MHP696_proteins_WP_039387598.1, MHP_MHP709_proteins_WP_160588358.1, MHP_131B_proteins_WP_160612820.1, MHP_133A_proteins_WP_160612820.1, MHP_MHP650_proteins_WP_013302014.1, MHP_MHP709_proteins_WP_258555376.1, MHP_MHP696_proteins_WP_160617525.1, MHP_ES2L_proteins_WP_218833876.1, MHP_131B_proteins_WP_404924508.1, MHP_133A_proteins_WP_215742022.1, MHP_F72C_proteins_WP_146379517.1, MHP_MHP691_proteins_WP_308704692.1, MHP_7422_proteins_WP_269076337.1, MHP_J_proteins_WP_011284151.1, MFC_ATCC27716_proteins_WP_081605288.1, MHP_4284_proteins_WP_406823110.1, MHP_MHP653_proteins_WP_308507049.1, MHP_1257_proteins_WP_348571687.1, MHP_UFV02_proteins_WP_243234976.1, MHP_1257_proteins_WP_348571684.1, MHP_UFV01_proteins_WP_243216171.1, MHP_111A_proteins_WP_404912243.1, MHP_112B_proteins_WP_404913720.1, MHP_MHP696_proteins_WP_308507069.1, MHP_MHP709_proteins_WP_308507069.1, MHP_153B_proteins_WP_404924193.1, MHP_154B_proteins_WP_404924193.1, MHP_ES2_proteins_WP_240536413.1, MFC_MF33_proteins_WP_308704746.1, MHP_131B_proteins_WP_404924493.1, MHP_133A_proteins_WP_404924493.1, MHP_LH_proteins_WP_233688768.1, MFC_MF11_proteins_WP_160603281.1, MHP_1257_proteins_WP_348571683.1, MFC_Ms42_proteins_WP_236681787.1, MHP_131B_proteins_WP_404924491.1, MHP_133A_proteins_WP_404924491.1, MHP_MHP691_proteins_WP_160608104.1, MHP_UFV01_proteins_WP_243216232.1, MHP_UFV02_proteins_WP_243216232.1, MHP_MHP650_proteins_WP_308704770.1, MFC_MF11_proteins_WP_308705401.1, MHP_MHP650_proteins_WP_160601261.1, MHP_MHP691_proteins_WP_220200664.1, MHP_MHP650_proteins_WP_160601285.1, MHP_MHP650_proteins_WP_160601277.1, MHP_LH_proteins_WP_233688766.1, MFC_MF22_proteins_WP_160584040.1, MHP_MHP650_proteins_WP_308704771.1, MHP_ES2_proteins_WP_215773932.1, MFC_MF11_proteins_WP_160603250.1, MHP_F72C_proteins_WP_225973023.1, MFC_MF29_proteins_WP_160581503.1, MHP_ES2L_proteins_WP_179221135.1, MHP_LH_proteins_WP_179221135.1, MHP_LH_proteins_WP_233688420.1, MHP_LH_proteins_WP_233688421.1, MHP_MHP653_proteins_WP_146420414.1, MFC_MF18_proteins_WP_255454543.1, MHP_112B_proteins_WP_404913722.1, MHP_153B_proteins_WP_404923932.1, MHP_154B_proteins_WP_404924573.1, MHP_154B_proteins_WP_404924574.1, MHP_153B_proteins_WP_404923933.1, MHP_116_proteins_WP_228729165.1, MHP_ES2_proteins_WP_228729165.1, MHP_MHP691_proteins_WP_258555627.1, MHP_4284_proteins_WP_406823111.1, MHP_MHP699_proteins_WP_220190702.1, MHP_MHP696_proteins_WP_334199371.1, MHP_MHP709_proteins_WP_334199371.1, MFC_MF33_proteins_WP_160602617.1, MFC_MF22_proteins_WP_308704672.1, MFC_MF29_proteins_WP_308704666.1, MFC_MF11_proteins_WP_308705396.1, MHP_ES2_proteins_WP_240536415.1, MFC_MF33_proteins_WP_220190092.1, MFC_MF29_proteins_WP_220200598.1, MHP_131B_proteins_WP_404924492.1, MHP_133A_proteins_WP_404924492.1, MFC_MF33_proteins_WP_160609447.1, MHP_153B_proteins_WP_404923931.1, MHP_154B_proteins_WP_404923931.1, MFC_MF33_proteins_WP_308704748.1, MFC_MF29_proteins_WP_160581501.1, MFC_Ms42_proteins_WP_236681786.1, MFC_ATCC27716_proteins_WP_040538362.1, MHP_F72C_proteins_WP_225973044.1, MFC_MF22_proteins_WP_160584064.1, MHP_116_proteins_WP_348602861.1, MHP_112B_proteins_WP_404912439.1, MHP_112B_proteins_WP_404913762.1, MHP_111A_proteins_WP_404912439.1, MFC_MF18_proteins_WP_308507121.1, MFC_MF11_proteins_WP_160603283.1, MFC_MF29_proteins_WP_308704667.1, MHP_4284_proteins_WP_406823112.1, MFC_MF22_proteins_WP_220190248.1, MFC_MF29_proteins_WP_160581500.1, MFC_ATCC27716_proteins_WP_196792419.1	MHP_MHP691_proteins_WP_160608126.1, MHP_1257_proteins_WP_348571641.1, MHP_MHP682_proteins_WP_308507011.1, MHP_153B_proteins_WP_404923947.1, MHP_LH_proteins_WP_233688428.1, MHP_UFV01_proteins_WP_243216180.1, MFC_Ms42_proteins_WP_052234585.1, MFC_Ms42_proteins_WP_039387605.1, MHP_UFV02_proteins_WP_308704548.1, MHP_154B_proteins_WP_404924576.1, MFC_Ms42_proteins_WP_236681772.1, MFC_Ms42_proteins_WP_039387597.1, MHP_131B_proteins_WP_404924511.1, MHP_133A_proteins_WP_404924221.1, MHP_ES2_proteins_WP_240536311.1, MHP_F72C_proteins_WP_225973024.1, MHP_111A_proteins_WP_404912245.1, MHP_112B_proteins_WP_404912245.1, MHP_7448_proteins_WP_044272483.1, MHP_7422_proteins_WP_041361655.1, MHP_MHP653_proteins_WP_258555974.1, MHP_ES2L_proteins_WP_218833871.1, MHP_MHP709_proteins_WP_160588362.1, MHP_Ue273_proteins_WP_347952213.1, MHP_MHP653_proteins_WP_160615939.1, MHP_133A_proteins_WP_404924466.1, MHP_111A_proteins_WP_404912390.1, MHP_131B_proteins_WP_404924562.1, MHP_J_proteins_WP_044284653.1, MHP_168L_proteins_WP_044889037.1, MHP_112B_proteins_WP_225973037.1, MHP_F72C_proteins_WP_225973037.1, MHP_98_proteins_WP_258556549.1, MHP_131B_proteins_WP_404924212.1, MHP_133A_proteins_WP_404924212.1, MHP_J_proteins_WP_044284650.1, MHP_116_proteins_WP_348602503.1, MHP_ES2L_proteins_WP_094521686.1, MHP_ES2_proteins_WP_094521686.1, MHP_KM014_proteins_WP_094521686.1, MHP_LH_proteins_WP_094521686.1, MHP_MHP699_proteins_WP_094521686.1, MHP_UFV01_proteins_WP_094521686.1, MHP_UFV02_proteins_WP_094521686.1, MHP_Ue273_proteins_WP_347952221.1, MHP_11_proteins_WP_206600680.1, MHP_232_proteins_WP_011206233.1, MHP_98_proteins_WP_308705287.1, MHP_F72C_proteins_WP_225973050.1, MHP_J_proteins_WP_044284658.1, MHP_112B_proteins_WP_404913633.1, MHP_131B_proteins_WP_148174330.1, MHP_133A_proteins_WP_148174330.1, MHP_7422_proteins_WP_148174330.1, MHP_7448_proteins_WP_148174330.1, MHP_116_proteins_WP_348602862.1, MHP_168_proteins_WP_014579857.1, MHP_TB1_proteins_WP_088764626.1, MHP_168L_proteins_WP_318023915.1, MHP_11_proteins_WP_129640575.1, MHP_232_proteins_WP_129640575.1, MHP_NCTC10127_proteins_WP_129640575.1, MHP_UFV01_proteins_WP_308705306.1, MHP_ES2_proteins_WP_135618898.1, MHP_UFV02_proteins_WP_243234982.1, MHP_MHP679_proteins_WP_308704714.1, MHP_MHP699_proteins_WP_308506999.1, MHP_ES2L_proteins_WP_318036674.1, MHP_LH_proteins_WP_318035154.1, MHP_MHP679_proteins_WP_258555731.1, MHP_MHP699_proteins_WP_258555731.1, MHP_MHP650_proteins_WP_308704769.1, MHP_MHP653_proteins_WP_240532016.1, MHP_111A_proteins_WP_404911849.1, MHP_7448_proteins_WP_052269173.1, MHP_UFV01_proteins_WP_052269173.1, MHP_F72C_proteins_WP_225972977.1, MHP_MHP653_proteins_WP_225972977.1, MHP_131B_proteins_WP_258556712.1, MHP_MHP650_proteins_WP_258556712.1, MHP_133A_proteins_WP_404924228.1, MHP_7422_proteins_WP_020835762.1, MHP_168L_proteins_WP_044889040.1, MHP_11_proteins_WP_088172539.1, MHP_232_proteins_WP_011206262.1, MHP_116_proteins_WP_348602524.1, MHP_ES2L_proteins_WP_240536594.1, MHP_ES2_proteins_WP_318026010.1, MHP_NCTC10127_proteins_WP_129640577.1, MHP_LH_proteins_WP_233688440.1, MHP_154B_proteins_WP_404924580.1, MHP_1257_proteins_WP_348571689.1, MHP_MHP694_proteins_WP_258555508.1, MHP_98_proteins_WP_308705289.1, MHP_MHP696_proteins_WP_308507073.1, MHP_MHP691_proteins_WP_258555636.1, MHP_153B_proteins_WP_404923956.1, MHP_MHP696_proteins_WP_160617531.1, MHP_MHP682_proteins_WP_160585837.1, MHP_1257_proteins_WP_348572146.1, MHP_MHP694_proteins_WP_160606967.1, MHP_154B_proteins_WP_404924636.1, MHP_1257_proteins_WP_348572099.1, MHP_116_proteins_WP_348602817.1, MHP_4284_proteins_WP_406823272.1, MHP_98_proteins_WP_308705293.1, MHP_7448_proteins_WP_044272432.1, MHP_ES2_proteins_WP_135618783.1, MHP_98_proteins_WP_258556573.1, MHP_MHP699_proteins_WP_160585044.1, MHP_MHP694_proteins_WP_160606771.1, MHP_232_proteins_WP_011206165.1, MFC_Ms42_proteins_WP_039387718.1, MFC_MF18_proteins_WP_160593488.1, MHP_TB1_proteins_WP_088764599.1, MHP_MHP696_proteins_WP_160617502.1, MHP_J_proteins_WP_044284630.1, MHP_112B_proteins_WP_404913746.1, MHP_111A_proteins_WP_404912388.1, MHP_133A_proteins_WP_404924465.1, MHP_154B_proteins_WP_404924621.1, MFC_MF11_proteins_WP_157696714.1, MHP_ES2L_proteins_WP_157696714.1, MHP_KM014_proteins_WP_157696714.1, MHP_11_proteins_WP_088172555.1, MHP_NCTC10127_proteins_WP_088172555.1, MHP_UFV02_proteins_WP_243234964.1, MHP_168L_proteins_WP_016340207.1, MHP_Ue273_proteins_WP_347952456.1, MHP_MHP709_proteins_WP_160588195.1, MHP_MHP679_proteins_WP_160590228.1, MHP_MHP653_proteins_WP_160615776.1, MHP_LH_proteins_WP_233688739.1, MHP_MHP650_proteins_WP_160601020.1, MHP_111A_proteins_WP_404912447.1, MFC_MF33_proteins_WP_160609401.1, MFC_MF11_proteins_WP_308705385.1, MFC_MF30_proteins_WP_160605580.1, MHP_KM014_proteins_WP_157696719.1, MHP_LH_proteins_WP_233688764.1, MHP_MHP650_proteins_WP_233688764.1, MFC_MF18_proteins_WP_160611384.1, MFC_MF22_proteins_WP_160583785.1, MFC_Ms42_proteins_WP_318023901.1, MFC_ATCC27716_proteins_WP_002557502.1, MFC_MF29_proteins_WP_160581134.1, MHP_UFV02_proteins_WP_243234990.1, MHP_UFV01_proteins_WP_243216097.1, MHP_154B_proteins_WP_404924630.1, MHP_153B_proteins_WP_404924157.1, MHP_133A_proteins_WP_404924488.1, MHP_131B_proteins_WP_404924561.1, MHP_MHP653_proteins_WP_308507040.1, MHP_MHP694_proteins_WP_308704611.1, MHP_MHP691_proteins_WP_258555591.1, MHP_F72C_proteins_WP_146379582.1, MHP_MHP696_proteins_WP_160617504.1, MHP_MHP709_proteins_WP_334199370.1, MHP_ES2L_proteins_WP_179221294.1, MHP_168L_proteins_WP_233417365.1, MHP_168_proteins_WP_233417365.1, MHP_TB1_proteins_WP_252862164.1, MHP_11_proteins_WP_323749055.1, MHP_232_proteins_WP_323749055.1, MHP_NCTC10127_proteins_WP_323749055.1, MHP_ES2_proteins_WP_318026031.1, MHP_J_proteins_WP_323749056.1, MHP_ES2_proteins_WP_334199108.1, MHP_Ue273_proteins_WP_347952486.1, MHP_7422_proteins_WP_020835681.1, MHP_7448_proteins_WP_081420845.1, MHP_MHP691_proteins_WP_160608120.1, MHP_MHP694_proteins_WP_160606939.1, MHP_MHP699_proteins_WP_308506991.1, MHP_MHP653_proteins_WP_334199374.1, MHP_MHP696_proteins_WP_308507068.1, MHP_MHP679_proteins_WP_308704704.1, MHP_111A_proteins_WP_404912449.1, MHP_112B_proteins_WP_404913748.1, MHP_MHP682_proteins_WP_160585691.1, MHP_131B_proteins_WP_404924489.1, MHP_133A_proteins_WP_404924489.1, MHP_98_proteins_WP_179696126.1
OG0000000	N0	n1	0.5909090909090909	Non-Terminal	MHP_MHP650_proteins_WP_160601283.1, MHP_1257_proteins_WP_348572148.1, MHP_153B_proteins_WP_404924195.1, MHP_154B_proteins_WP_404924635.1, MHP_131B_proteins_WP_404924494.1, MHP_133A_proteins_WP_404924494.1, MHP_7448_proteins_WP_228366139.1, MHP_MHP696_proteins_WP_220200970.1, MHP_MHP709_proteins_WP_258555378.1, MFC_MF11_proteins_WP_160603262.1, MFC_MF29_proteins_WP_160581495.1, MFC_MF33_proteins_WP_308704747.1, MFC_ATCC27716_proteins_WP_318023896.1, MFC_Ms42_proteins_WP_318023896.1, MFC_MF30_proteins_WP_308705463.1, MFC_MF22_proteins_WP_308704674.1, MFC_MF18_proteins_WP_220190423.1, MHP_LH_proteins_WP_233688770.1, MHP_NCTC10127_proteins_WP_129640571.1, MHP_11_proteins_WP_202943179.1, MHP_232_proteins_WP_202943179.1, MHP_TB1_proteins_WP_252862191.1, MHP_168L_proteins_WP_318023914.1, MHP_168_proteins_WP_014579837.1, MHP_J_proteins_WP_237697250.1, MHP_UFV01_proteins_WP_243216234.1, MHP_UFV02_proteins_WP_243216234.1, MHP_116_proteins_WP_348602510.1, MHP_ES2_proteins_WP_240536417.1, MHP_MHP653_proteins_WP_308507050.1, MHP_1257_proteins_WP_348571665.1, MHP_4284_proteins_WP_406823103.1, MHP_MHP682_proteins_WP_371807681.1, MHP_MHP650_proteins_WP_160601117.1, MHP_Ue273_proteins_WP_347952487.1, MHP_98_proteins_WP_308705288.1, MHP_112B_proteins_WP_404913768.1, MHP_F72C_proteins_WP_318026087.1, MHP_MHP694_proteins_WP_160606961.1, MHP_4284_proteins_WP_406823094.1, MHP_MHP694_proteins_WP_308704620.1	MFC_MF22_proteins_WP_308704675.1, MFC_MF33_proteins_WP_308704750.1, MHP_7422_proteins_WP_318023952.1, MHP_MHP691_proteins_WP_308704676.1, MFC_MF29_proteins_WP_308704665.1, MFC_MF30_proteins_WP_308705464.1, MFC_MF18_proteins_WP_220190424.1, MFC_Ms42_proteins_WP_236681788.1, MFC_MF30_proteins_WP_220190802.1, MHP_LH_proteins_WP_233688769.1, MFC_ATCC27716_proteins_WP_334199007.1, MFC_MF18_proteins_WP_160593552.1, MFC_MF22_proteins_WP_255454545.1, MHP_MHP699_proteins_WP_160585134.1, MHP_ES2_proteins_WP_135618868.1, MHP_J_proteins_WP_202793361.1, MHP_KM014_proteins_WP_094521687.1, MHP_LH_proteins_WP_233688767.1, MHP_F72C_proteins_WP_225973043.1, MHP_153B_proteins_WP_404924194.1, MHP_154B_proteins_WP_404924634.1, MHP_ES2L_proteins_WP_240536667.1, MHP_ES2L_proteins_WP_240536668.1, MHP_116_proteins_WP_348602860.1, MHP_MHP696_proteins_WP_308507072.1, MHP_MHP709_proteins_WP_308507072.1, MHP_MHP653_proteins_WP_160615959.1, MHP_MHP679_proteins_WP_160590517.1, MHP_116_proteins_WP_348602504.1, MFC_MF22_proteins_WP_039387598.1, MFC_Ms42_proteins_WP_039387598.1, MHP_KM014_proteins_WP_039387598.1, MHP_MHP696_proteins_WP_039387598.1, MHP_MHP709_proteins_WP_160588358.1, MHP_131B_proteins_WP_160612820.1, MHP_133A_proteins_WP_160612820.1, MHP_MHP650_proteins_WP_013302014.1, MHP_MHP709_proteins_WP_258555376.1, MHP_MHP696_proteins_WP_160617525.1, MHP_ES2L_proteins_WP_218833876.1, MHP_131B_proteins_WP_404924508.1, MHP_133A_proteins_WP_215742022.1, MHP_F72C_proteins_WP_146379517.1, MHP_MHP691_proteins_WP_308704692.1, MHP_7422_proteins_WP_269076337.1, MHP_J_proteins_WP_011284151.1, MFC_ATCC27716_proteins_WP_081605288.1, MHP_4284_proteins_WP_406823110.1, MHP_MHP653_proteins_WP_308507049.1, MHP_1257_proteins_WP_348571687.1, MHP_UFV02_proteins_WP_243234976.1, MHP_1257_proteins_WP_348571684.1, MHP_UFV01_proteins_WP_243216171.1, MHP_111A_proteins_WP_404912243.1, MHP_112B_proteins_WP_404913720.1, MHP_MHP696_proteins_WP_308507069.1, MHP_MHP709_proteins_WP_308507069.1, MHP_153B_proteins_WP_404924193.1, MHP_154B_proteins_WP_404924193.1, MHP_ES2_proteins_WP_240536413.1, MFC_MF33_proteins_WP_308704746.1, MHP_131B_proteins_WP_404924493.1, MHP_133A_proteins_WP_404924493.1, MHP_LH_proteins_WP_233688768.1, MFC_MF11_proteins_WP_160603281.1, MHP_1257_proteins_WP_348571683.1, MFC_Ms42_proteins_WP_236681787.1, MHP_131B_proteins_WP_404924491.1, MHP_133A_proteins_WP_404924491.1, MHP_MHP691_proteins_WP_160608104.1, MHP_UFV01_proteins_WP_243216232.1, MHP_UFV02_proteins_WP_243216232.1, MHP_MHP650_proteins_WP_308704770.1, MFC_MF11_proteins_WP_308705401.1, MHP_MHP650_proteins_WP_160601261.1, MHP_MHP691_proteins_WP_220200664.1, MHP_MHP650_proteins_WP_160601285.1, MHP_MHP650_proteins_WP_160601277.1, MHP_LH_proteins_WP_233688766.1, MFC_MF22_proteins_WP_160584040.1, MHP_MHP650_proteins_WP_308704771.1, MHP_ES2_proteins_WP_215773932.1, MFC_MF11_proteins_WP_160603250.1, MHP_F72C_proteins_WP_225973023.1, MFC_MF29_proteins_WP_160581503.1, MHP_ES2L_proteins_WP_179221135.1, MHP_LH_proteins_WP_179221135.1, MHP_LH_proteins_WP_233688420.1, MHP_LH_proteins_WP_233688421.1, MHP_MHP653_proteins_WP_146420414.1, MFC_MF18_proteins_WP_255454543.1, MHP_112B_proteins_WP_404913722.1, MHP_153B_proteins_WP_404923932.1, MHP_154B_proteins_WP_404924573.1, MHP_154B_proteins_WP_404924574.1, MHP_153B_proteins_WP_404923933.1, MHP_116_proteins_WP_228729165.1, MHP_ES2_proteins_WP_228729165.1, MHP_MHP691_proteins_WP_258555627.1, MHP_4284_proteins_WP_406823111.1, MHP_MHP699_proteins_WP_220190702.1, MHP_MHP696_proteins_WP_334199371.1, MHP_MHP709_proteins_WP_334199371.1, MFC_MF33_proteins_WP_160602617.1, MFC_MF22_proteins_WP_308704672.1, MFC_MF29_proteins_WP_308704666.1, MFC_MF11_proteins_WP_308705396.1, MHP_ES2_proteins_WP_240536415.1, MFC_MF33_proteins_WP_220190092.1, MFC_MF29_proteins_WP_220200598.1, MHP_131B_proteins_WP_404924492.1, MHP_133A_proteins_WP_404924492.1, MFC_MF33_proteins_WP_160609447.1, MHP_153B_proteins_WP_404923931.1, MHP_154B_proteins_WP_404923931.1, MFC_MF33_proteins_WP_308704748.1, MFC_MF29_proteins_WP_160581501.1, MFC_Ms42_proteins_WP_236681786.1, MFC_ATCC27716_proteins_WP_040538362.1, MHP_F72C_proteins_WP_225973044.1, MFC_MF22_proteins_WP_160584064.1, MHP_116_proteins_WP_348602861.1, MHP_112B_proteins_WP_404912439.1, MHP_112B_proteins_WP_404913762.1, MHP_111A_proteins_WP_404912439.1, MFC_MF18_proteins_WP_308507121.1, MFC_MF11_proteins_WP_160603283.1, MFC_MF29_proteins_WP_308704667.1, MHP_4284_proteins_WP_406823112.1, MFC_MF22_proteins_WP_220190248.1, MFC_MF29_proteins_WP_160581500.1, MFC_ATCC27716_proteins_WP_196792419.1
OG0000000	N0	n2	0.045454545454545456	Non-Terminal	MHP_MHP650_proteins_WP_160601283.1, MHP_1257_proteins_WP_348572148.1	MHP_153B_proteins_WP_404924195.1, MHP_154B_proteins_WP_404924635.1, MHP_131B_proteins_WP_404924494.1, MHP_133A_proteins_WP_404924494.1, MHP_7448_proteins_WP_228366139.1, MHP_MHP696_proteins_WP_220200970.1, MHP_MHP709_proteins_WP_258555378.1, MFC_MF11_proteins_WP_160603262.1, MFC_MF29_proteins_WP_160581495.1, MFC_MF33_proteins_WP_308704747.1, MFC_ATCC27716_proteins_WP_318023896.1, MFC_Ms42_proteins_WP_318023896.1, MFC_MF30_proteins_WP_308705463.1, MFC_MF22_proteins_WP_308704674.1, MFC_MF18_proteins_WP_220190423.1, MHP_LH_proteins_WP_233688770.1, MHP_NCTC10127_proteins_WP_129640571.1, MHP_11_proteins_WP_202943179.1, MHP_232_proteins_WP_202943179.1, MHP_TB1_proteins_WP_252862191.1, MHP_168L_proteins_WP_318023914.1, MHP_168_proteins_WP_014579837.1, MHP_J_proteins_WP_237697250.1, MHP_UFV01_proteins_WP_243216234.1, MHP_UFV02_proteins_WP_243216234.1, MHP_116_proteins_WP_348602510.1, MHP_ES2_proteins_WP_240536417.1, MHP_MHP653_proteins_WP_308507050.1, MHP_1257_proteins_WP_348571665.1, MHP_4284_proteins_WP_406823103.1, MHP_MHP682_proteins_WP_371807681.1, MHP_MHP650_proteins_WP_160601117.1, MHP_Ue273_proteins_WP_347952487.1, MHP_98_proteins_WP_308705288.1, MHP_112B_proteins_WP_404913768.1, MHP_F72C_proteins_WP_318026087.1, MHP_MHP694_proteins_WP_160606961.1, MHP_4284_proteins_WP_406823094.1, MHP_MHP694_proteins_WP_308704620.1
OG0000000	N0	n4	0.045454545454545456	Non-Terminal	MHP_153B_proteins_WP_404924195.1, MHP_154B_proteins_WP_404924635.1, MHP_131B_proteins_WP_404924494.1, MHP_133A_proteins_WP_404924494.1, MHP_7448_proteins_WP_228366139.1, MHP_MHP696_proteins_WP_220200970.1, MHP_MHP709_proteins_WP_258555378.1, MFC_MF11_proteins_WP_160603262.1, MFC_MF29_proteins_WP_160581495.1, MFC_MF33_proteins_WP_308704747.1, MFC_ATCC27716_proteins_WP_318023896.1, MFC_Ms42_proteins_WP_318023896.1, MFC_MF30_proteins_WP_308705463.1, MFC_MF22_proteins_WP_308704674.1, MFC_MF18_proteins_WP_220190423.1, MHP_LH_proteins_WP_233688770.1, MHP_NCTC10127_proteins_WP_129640571.1, MHP_11_proteins_WP_202943179.1, MHP_232_proteins_WP_202943179.1, MHP_TB1_proteins_WP_252862191.1, MHP_168L_proteins_WP_318023914.1, MHP_168_proteins_WP_014579837.1, MHP_J_proteins_WP_237697250.1, MHP_UFV01_proteins_WP_243216234.1, MHP_UFV02_proteins_WP_243216234.1, MHP_116_proteins_WP_348602510.1, MHP_ES2_proteins_WP_240536417.1, MHP_MHP653_proteins_WP_308507050.1, MHP_1257_proteins_WP_348571665.1, MHP_4284_proteins_WP_406823103.1, MHP_MHP682_proteins_WP_371807681.1, MHP_MHP650_proteins_WP_160601117.1, MHP_Ue273_proteins_WP_347952487.1, MHP_98_proteins_WP_308705288.1, MHP_112B_proteins_WP_404913768.1, MHP_F72C_proteins_WP_318026087.1, MHP_MHP694_proteins_WP_160606961.1	MHP_4284_proteins_WP_406823094.1, MHP_MHP694_proteins_WP_308704620.1
OG0000000	N0	n42	0.18181818181818182	Non-Terminal	MFC_MF22_proteins_WP_308704675.1, MFC_MF33_proteins_WP_308704750.1, MHP_7422_proteins_WP_318023952.1, MHP_MHP691_proteins_WP_308704676.1, MFC_MF29_proteins_WP_308704665.1, MFC_MF30_proteins_WP_308705464.1, MFC_MF18_proteins_WP_220190424.1, MFC_Ms42_proteins_WP_236681788.1	MFC_MF30_proteins_WP_220190802.1, MHP_LH_proteins_WP_233688769.1, MFC_ATCC27716_proteins_WP_334199007.1, MFC_MF18_proteins_WP_160593552.1, MFC_MF22_proteins_WP_255454545.1, MHP_MHP699_proteins_WP_160585134.1, MHP_ES2_proteins_WP_135618868.1, MHP_J_proteins_WP_202793361.1, MHP_KM014_proteins_WP_094521687.1, MHP_LH_proteins_WP_233688767.1, MHP_F72C_proteins_WP_225973043.1, MHP_153B_proteins_WP_404924194.1, MHP_154B_proteins_WP_404924634.1, MHP_ES2L_proteins_WP_240536667.1, MHP_ES2L_proteins_WP_240536668.1, MHP_116_proteins_WP_348602860.1, MHP_MHP696_proteins_WP_308507072.1, MHP_MHP709_proteins_WP_308507072.1, MHP_MHP653_proteins_WP_160615959.1, MHP_MHP679_proteins_WP_160590517.1, MHP_116_proteins_WP_348602504.1, MFC_MF22_proteins_WP_039387598.1, MFC_Ms42_proteins_WP_039387598.1, MHP_KM014_proteins_WP_039387598.1, MHP_MHP696_proteins_WP_039387598.1, MHP_MHP709_proteins_WP_160588358.1, MHP_131B_proteins_WP_160612820.1, MHP_133A_proteins_WP_160612820.1, MHP_MHP650_proteins_WP_013302014.1, MHP_MHP709_proteins_WP_258555376.1, MHP_MHP696_proteins_WP_160617525.1, MHP_ES2L_proteins_WP_218833876.1, MHP_131B_proteins_WP_404924508.1, MHP_133A_proteins_WP_215742022.1, MHP_F72C_proteins_WP_146379517.1, MHP_MHP691_proteins_WP_308704692.1, MHP_7422_proteins_WP_269076337.1, MHP_J_proteins_WP_011284151.1, MFC_ATCC27716_proteins_WP_081605288.1, MHP_4284_proteins_WP_406823110.1, MHP_MHP653_proteins_WP_308507049.1, MHP_1257_proteins_WP_348571687.1, MHP_UFV02_proteins_WP_243234976.1, MHP_1257_proteins_WP_348571684.1, MHP_UFV01_proteins_WP_243216171.1, MHP_111A_proteins_WP_404912243.1, MHP_112B_proteins_WP_404913720.1, MHP_MHP696_proteins_WP_308507069.1, MHP_MHP709_proteins_WP_308507069.1, MHP_153B_proteins_WP_404924193.1, MHP_154B_proteins_WP_404924193.1, MHP_ES2_proteins_WP_240536413.1, MFC_MF33_proteins_WP_308704746.1, MHP_131B_proteins_WP_404924493.1, MHP_133A_proteins_WP_404924493.1, MHP_LH_proteins_WP_233688768.1, MFC_MF11_proteins_WP_160603281.1, MHP_1257_proteins_WP_348571683.1, MFC_Ms42_proteins_WP_236681787.1, MHP_131B_proteins_WP_404924491.1, MHP_133A_proteins_WP_404924491.1, MHP_MHP691_proteins_WP_160608104.1, MHP_UFV01_proteins_WP_243216232.1, MHP_UFV02_proteins_WP_243216232.1, MHP_MHP650_proteins_WP_308704770.1, MFC_MF11_proteins_WP_308705401.1, MHP_MHP650_proteins_WP_160601261.1, MHP_MHP691_proteins_WP_220200664.1, MHP_MHP650_proteins_WP_160601285.1, MHP_MHP650_proteins_WP_160601277.1, MHP_LH_proteins_WP_233688766.1, MFC_MF22_proteins_WP_160584040.1, MHP_MHP650_proteins_WP_308704771.1, MHP_ES2_proteins_WP_215773932.1, MFC_MF11_proteins_WP_160603250.1, MHP_F72C_proteins_WP_225973023.1, MFC_MF29_proteins_WP_160581503.1, MHP_ES2L_proteins_WP_179221135.1, MHP_LH_proteins_WP_179221135.1, MHP_LH_proteins_WP_233688420.1, MHP_LH_proteins_WP_233688421.1, MHP_MHP653_proteins_WP_146420414.1, MFC_MF18_proteins_WP_255454543.1, MHP_112B_proteins_WP_404913722.1, MHP_153B_proteins_WP_404923932.1, MHP_154B_proteins_WP_404924573.1, MHP_154B_proteins_WP_404924574.1, MHP_153B_proteins_WP_404923933.1, MHP_116_proteins_WP_228729165.1, MHP_ES2_proteins_WP_228729165.1, MHP_MHP691_proteins_WP_258555627.1, MHP_4284_proteins_WP_406823111.1, MHP_MHP699_proteins_WP_220190702.1, MHP_MHP696_proteins_WP_334199371.1, MHP_MHP709_proteins_WP_334199371.1, MFC_MF33_proteins_WP_160602617.1, MFC_MF22_proteins_WP_308704672.1, MFC_MF29_proteins_WP_308704666.1, MFC_MF11_proteins_WP_308705396.1, MHP_ES2_proteins_WP_240536415.1, MFC_MF33_proteins_WP_220190092.1, MFC_MF29_proteins_WP_220200598.1, MHP_131B_proteins_WP_404924492.1, MHP_133A_proteins_WP_404924492.1, MFC_MF33_proteins_WP_160609447.1, MHP_153B_proteins_WP_404923931.1, MHP_154B_proteins_WP_404923931.1, MFC_MF33_proteins_WP_308704748.1, MFC_MF29_proteins_WP_160581501.1, MFC_Ms42_proteins_WP_236681786.1, MFC_ATCC27716_proteins_WP_040538362.1, MHP_F72C_proteins_WP_225973044.1, MFC_MF22_proteins_WP_160584064.1, MHP_116_proteins_WP_348602861.1, MHP_112B_proteins_WP_404912439.1, MHP_112B_proteins_WP_404913762.1, MHP_111A_proteins_WP_404912439.1, MFC_MF18_proteins_WP_308507121.1, MFC_MF11_proteins_WP_160603283.1, MFC_MF29_proteins_WP_308704667.1, MHP_4284_proteins_WP_406823112.1, MFC_MF22_proteins_WP_220190248.1, MFC_MF29_proteins_WP_160581500.1, MFC_ATCC27716_proteins_WP_196792419.1
