Orthogroup	Species Tree Node	Gene Tree Node	Support	Type	Genes 1	Genes 2
OG0000028	N29	n23	1.0	Non-Terminal	MHP_UFV01_proteins_WP_243216220.1, MHP_UFV02_proteins_WP_243234986.1	MHP_UFV01_proteins_WP_243216222.1, MHP_UFV02_proteins_WP_243234987.1
OG0000028	N28	n27	0.06666666666666667	Non-Terminal	MHP_J_proteins_WP_044284666.1	MHP_J_proteins_WP_044284667.1, MHP_11_proteins_WP_088172546.1, MHP_NCTC10127_proteins_WP_129640581.1, MHP_232_proteins_WP_011206281.1, MHP_TB1_proteins_WP_252862177.1, MHP_168L_proteins_WP_044889042.1, MHP_168_proteins_WP_044278014.1, MHP_168L_proteins_WP_044889041.1, MHP_TB1_proteins_WP_252862176.1, MHP_TB1_proteins_WP_189220795.1, MHP_168_proteins_WP_044278015.1, MHP_TB1_proteins_WP_252862178.1
OG0000028	N32	n32	0.3333333333333333	Non-Terminal	MHP_TB1_proteins_WP_252862177.1, MHP_168L_proteins_WP_044889042.1, MHP_168_proteins_WP_044278014.1, MHP_168L_proteins_WP_044889041.1, MHP_TB1_proteins_WP_252862176.1, MHP_TB1_proteins_WP_189220795.1, MHP_168_proteins_WP_044278015.1	MHP_TB1_proteins_WP_252862178.1
OG0000028	N32	n33	0.6666666666666666	Non-Terminal	MHP_TB1_proteins_WP_252862177.1, MHP_168L_proteins_WP_044889042.1	MHP_168_proteins_WP_044278014.1, MHP_168L_proteins_WP_044889041.1, MHP_TB1_proteins_WP_252862176.1, MHP_TB1_proteins_WP_189220795.1, MHP_168_proteins_WP_044278015.1
OG0000028	N32	n35	0.6666666666666666	Non-Terminal	MHP_168_proteins_WP_044278014.1, MHP_168L_proteins_WP_044889041.1, MHP_TB1_proteins_WP_252862176.1	MHP_TB1_proteins_WP_189220795.1, MHP_168_proteins_WP_044278015.1
OG0000028	N0	n39	0.022727272727272728	Non-Terminal	MHP_KM014_proteins_WP_094521711.1	MHP_ES2_proteins_WP_135618930.1, MHP_153B_proteins_WP_404923970.1, MHP_154B_proteins_WP_404924585.1, MHP_MHP699_proteins_WP_160585151.1, MHP_4284_proteins_WP_406823124.1, MHP_MHP696_proteins_WP_160617508.1, MHP_MHP709_proteins_WP_160588297.1, MHP_133A_proteins_WP_404924245.1, MHP_131B_proteins_WP_404924522.1, MHP_131B_proteins_WP_404924521.1, MHP_111A_proteins_WP_404911882.1, MHP_112B_proteins_WP_404913643.1, MHP_MHP653_proteins_WP_160615730.1, MHP_MHP691_proteins_WP_160607995.1, MHP_F72C_proteins_WP_146379651.1, MHP_7422_proteins_WP_020835779.1, MHP_7448_proteins_WP_044272522.1, MHP_112B_proteins_WP_404913645.1, MHP_MHP699_proteins_WP_160585085.1, MHP_111A_proteins_WP_404911884.1, MHP_MHP691_proteins_WP_220200632.1, MHP_MHP679_proteins_WP_160590323.1, MHP_MHP694_proteins_WP_160606823.1, MHP_ES2L_proteins_WP_179221152.1, MHP_98_proteins_WP_179695973.1, MHP_MHP694_proteins_WP_160606721.1, MHP_Ue273_proteins_WP_347952235.1, MHP_1257_proteins_WP_348571725.1, MHP_116_proteins_WP_348602538.1, MHP_MHP650_proteins_WP_160600719.1, MHP_MHP650_proteins_WP_160600717.1, MHP_MHP682_proteins_WP_160585779.1, MHP_MHP679_proteins_WP_160590450.1, MHP_MHP682_proteins_WP_160585704.1, MHP_MHP653_proteins_WP_160615732.1, MHP_KM014_proteins_WP_094521710.1
OG0000028	N0	n44	0.022727272727272728	Non-Terminal	MHP_MHP699_proteins_WP_160585151.1, MHP_4284_proteins_WP_406823124.1, MHP_MHP696_proteins_WP_160617508.1, MHP_MHP709_proteins_WP_160588297.1, MHP_133A_proteins_WP_404924245.1, MHP_131B_proteins_WP_404924522.1, MHP_131B_proteins_WP_404924521.1, MHP_111A_proteins_WP_404911882.1, MHP_112B_proteins_WP_404913643.1, MHP_MHP653_proteins_WP_160615730.1, MHP_MHP691_proteins_WP_160607995.1, MHP_F72C_proteins_WP_146379651.1, MHP_7422_proteins_WP_020835779.1, MHP_7448_proteins_WP_044272522.1, MHP_112B_proteins_WP_404913645.1, MHP_MHP699_proteins_WP_160585085.1, MHP_111A_proteins_WP_404911884.1, MHP_MHP691_proteins_WP_220200632.1, MHP_MHP679_proteins_WP_160590323.1, MHP_MHP694_proteins_WP_160606823.1, MHP_ES2L_proteins_WP_179221152.1, MHP_98_proteins_WP_179695973.1, MHP_MHP694_proteins_WP_160606721.1, MHP_Ue273_proteins_WP_347952235.1, MHP_1257_proteins_WP_348571725.1, MHP_116_proteins_WP_348602538.1, MHP_MHP650_proteins_WP_160600719.1, MHP_MHP650_proteins_WP_160600717.1, MHP_MHP682_proteins_WP_160585779.1, MHP_MHP679_proteins_WP_160590450.1, MHP_MHP682_proteins_WP_160585704.1	MHP_MHP653_proteins_WP_160615732.1
OG0000028	N0	n46	0.09090909090909091	Non-Terminal	MHP_MHP699_proteins_WP_160585151.1, MHP_4284_proteins_WP_406823124.1, MHP_MHP696_proteins_WP_160617508.1, MHP_MHP709_proteins_WP_160588297.1, MHP_133A_proteins_WP_404924245.1, MHP_131B_proteins_WP_404924522.1, MHP_131B_proteins_WP_404924521.1, MHP_111A_proteins_WP_404911882.1, MHP_112B_proteins_WP_404913643.1, MHP_MHP653_proteins_WP_160615730.1, MHP_MHP691_proteins_WP_160607995.1, MHP_F72C_proteins_WP_146379651.1, MHP_7422_proteins_WP_020835779.1, MHP_7448_proteins_WP_044272522.1	MHP_112B_proteins_WP_404913645.1, MHP_MHP699_proteins_WP_160585085.1, MHP_111A_proteins_WP_404911884.1, MHP_MHP691_proteins_WP_220200632.1
OG0000028	MHP_131B_proteins	n53	1.0	Terminal	MHP_131B_proteins_WP_404924522.1	MHP_131B_proteins_WP_404924521.1
OG0000028	N2	n63	0.047619047619047616	Non-Terminal	MHP_MHP679_proteins_WP_160590323.1, MHP_MHP694_proteins_WP_160606823.1	MHP_ES2L_proteins_WP_179221152.1, MHP_98_proteins_WP_179695973.1, MHP_MHP694_proteins_WP_160606721.1, MHP_Ue273_proteins_WP_347952235.1, MHP_1257_proteins_WP_348571725.1, MHP_116_proteins_WP_348602538.1, MHP_MHP650_proteins_WP_160600719.1, MHP_MHP650_proteins_WP_160600717.1, MHP_MHP682_proteins_WP_160585779.1, MHP_MHP679_proteins_WP_160590450.1, MHP_MHP682_proteins_WP_160585704.1
OG0000028	N2	n65	0.023809523809523808	Non-Terminal	MHP_ES2L_proteins_WP_179221152.1, MHP_98_proteins_WP_179695973.1, MHP_MHP694_proteins_WP_160606721.1, MHP_Ue273_proteins_WP_347952235.1, MHP_1257_proteins_WP_348571725.1, MHP_116_proteins_WP_348602538.1, MHP_MHP650_proteins_WP_160600719.1	MHP_MHP650_proteins_WP_160600717.1, MHP_MHP682_proteins_WP_160585779.1, MHP_MHP679_proteins_WP_160590450.1, MHP_MHP682_proteins_WP_160585704.1
OG0000028	N17	n73	0.25	Non-Terminal	MHP_MHP682_proteins_WP_160585779.1	MHP_MHP679_proteins_WP_160590450.1, MHP_MHP682_proteins_WP_160585704.1
OG0000029	N0	n8	0.6818181818181818	Non-Terminal	MHP_168_proteins_WP_014579599.1, MHP_168L_proteins_WP_016340189.1, MHP_TB1_proteins_WP_088764612.1, MHP_ES2L_proteins_WP_179221049.1, MHP_11_proteins_WP_088172532.1, MHP_232_proteins_WP_011206020.1, MHP_NCTC10127_proteins_WP_129640620.1, MHP_LH_proteins_WP_233688669.1, MHP_ES2_proteins_WP_135618627.1, MHP_MHP650_proteins_WP_160601095.1, MHP_J_proteins_WP_011283979.1, MHP_153B_proteins_WP_404924086.1, MHP_7422_proteins_WP_020835602.1, MHP_7448_proteins_WP_011290069.1, MHP_MHP694_proteins_WP_160606678.1, MHP_1257_proteins_WP_348571967.1, MHP_MHP691_proteins_WP_160608024.1, MHP_98_proteins_WP_179695967.1, MHP_131B_proteins_WP_404924422.1, MHP_133A_proteins_WP_404924422.1, MHP_UFV01_proteins_WP_243216007.1, MHP_UFV02_proteins_WP_243234961.1, MHP_F72C_proteins_WP_146379525.1, MHP_4284_proteins_WP_406823230.1, MHP_116_proteins_WP_348602714.1, MHP_MHP696_proteins_WP_160588071.1, MHP_MHP709_proteins_WP_160588071.1, MHP_MHP699_proteins_WP_160585310.1, MHP_Ue273_proteins_WP_347952396.1, MHP_111A_proteins_WP_404912268.1, MHP_112B_proteins_WP_404913726.1, MHP_MHP679_proteins_WP_160590401.1, MHP_MHP682_proteins_WP_160585736.1	MHP_1257_proteins_WP_348572001.1, MHP_98_proteins_WP_179696117.1, MHP_MHP699_proteins_WP_160584789.1, MHP_F72C_proteins_WP_146379491.1, MHP_MHP653_proteins_WP_160615937.1, MHP_131B_proteins_WP_404924400.1, MHP_133A_proteins_WP_404924400.1, MHP_J_proteins_WP_011283914.1, MHP_MHP694_proteins_WP_160606674.1, MHP_116_proteins_WP_348602752.1, MHP_Ue273_proteins_WP_347952383.1, MHP_ES2L_proteins_WP_179221019.1, MHP_TB1_proteins_WP_252862204.1, MHP_168L_proteins_WP_014579659.1, MHP_168_proteins_WP_014579659.1, MHP_TB1_proteins_WP_252862203.1, MHP_MHP691_proteins_WP_160608062.1, MHP_MHP696_proteins_WP_160587963.1, MHP_MHP709_proteins_WP_160587963.1, MHP_111A_proteins_WP_404912190.1, MHP_112B_proteins_WP_404912190.1, MHP_UFV01_proteins_WP_243215981.1, MHP_UFV02_proteins_WP_243215981.1, MHP_153B_proteins_WP_404924105.1, MHP_7448_proteins_WP_011290012.1, MHP_7422_proteins_WP_020835564.1, MHP_ES2_proteins_WP_135618559.1, MHP_11_proteins_WP_011206108.1, MHP_232_proteins_WP_011206108.1, MHP_NCTC10127_proteins_WP_011206108.1, MHP_MHP650_proteins_WP_160601231.1, MHP_LH_proteins_WP_233688642.1
OG0000029	N32	n54	0.3333333333333333	Non-Terminal	MHP_TB1_proteins_WP_252862204.1	MHP_168L_proteins_WP_014579659.1, MHP_168_proteins_WP_014579659.1, MHP_TB1_proteins_WP_252862203.1
OG0000030	N0	n7	0.6590909090909091	Non-Terminal	MHP_116_proteins_WP_348602635.1, MHP_MHP682_proteins_WP_308507013.1, MHP_111A_proteins_WP_240536353.1, MHP_112B_proteins_WP_240536353.1, MHP_4284_proteins_WP_240536353.1, MHP_ES2_proteins_WP_240536353.1, MHP_MHP653_proteins_WP_240536353.1, MHP_MHP691_proteins_WP_240536353.1, MHP_MHP699_proteins_WP_240536353.1, MHP_98_proteins_WP_308705276.1, MHP_232_proteins_WP_238374141.1, MHP_11_proteins_WP_232039555.1, MHP_LH_proteins_WP_232039555.1, MHP_NCTC10127_proteins_WP_232039555.1, MHP_ES2L_proteins_WP_179221248.1, MHP_153B_proteins_WP_404924037.1, MHP_154B_proteins_WP_404924603.1, MHP_7448_proteins_WP_044272656.1, MHP_F72C_proteins_WP_044272656.1, MHP_1257_proteins_WP_348571860.1, MHP_MHP696_proteins_WP_160588148.1, MHP_MHP709_proteins_WP_160588148.1, MHP_TB1_proteins_WP_016340249.1, MHP_168L_proteins_WP_228365396.1, MHP_168_proteins_WP_228365396.1, MHP_UFV01_proteins_WP_243215857.1, MHP_UFV02_proteins_WP_243215857.1, MHP_MHP650_proteins_WP_308704764.1, MHP_J_proteins_WP_237697218.1, MHP_131B_proteins_WP_308704613.1, MHP_133A_proteins_WP_308704613.1, MHP_MHP679_proteins_WP_308704613.1, MHP_MHP694_proteins_WP_308704613.1, MHP_7422_proteins_WP_236607958.1	MHP_J_proteins_WP_044284724.1, MHP_98_proteins_WP_308705275.1, MHP_1257_proteins_WP_020835904.1, MHP_133A_proteins_WP_020835904.1, MHP_7422_proteins_WP_020835904.1, MHP_ES2_proteins_WP_020835904.1, MHP_KM014_proteins_WP_020835904.1, MHP_LH_proteins_WP_020835904.1, MHP_MHP694_proteins_WP_020835904.1, MHP_MHP696_proteins_WP_020835904.1, MHP_MHP709_proteins_WP_020835904.1, MHP_MHP691_proteins_WP_160607730.1, MHP_131B_proteins_WP_404924534.1, MHP_7448_proteins_WP_044272658.1, MHP_168L_proteins_WP_014580003.1, MHP_168_proteins_WP_014580003.1, MHP_TB1_proteins_WP_014580003.1, MHP_111A_proteins_WP_404912053.1, MHP_112B_proteins_WP_404912053.1, MHP_MHP650_proteins_WP_160590224.1, MHP_MHP679_proteins_WP_160590224.1, MHP_ES2L_proteins_WP_179221250.1, MHP_11_proteins_WP_011206479.1, MHP_232_proteins_WP_011206479.1, MHP_NCTC10127_proteins_WP_011206479.1, MHP_UFV01_proteins_WP_243215862.1, MHP_UFV02_proteins_WP_243215862.1, MHP_MHP653_proteins_WP_160615617.1, MHP_MHP682_proteins_WP_160584917.1, MHP_MHP699_proteins_WP_160584917.1, MHP_Ue273_proteins_WP_160584917.1
OG0000031	N2	n8	0.35714285714285715	Non-Terminal	MHP_TB1_proteins_WP_252862171.1, MHP_MHP679_proteins_WP_160590091.1, MHP_11_proteins_WP_088172525.1, MHP_131B_proteins_WP_088172525.1, MHP_133A_proteins_WP_088172525.1, MHP_KM014_proteins_WP_088172525.1, MHP_MHP650_proteins_WP_088172525.1, MHP_MHP682_proteins_WP_088172525.1, MHP_MHP699_proteins_WP_088172525.1, MHP_111A_proteins_WP_404912416.1, MHP_112B_proteins_WP_404912416.1, MHP_153B_proteins_WP_404923928.1, MHP_154B_proteins_WP_404923928.1, MHP_98_proteins_WP_179695837.1, MHP_LH_proteins_WP_179695837.1, MHP_168L_proteins_WP_011206356.1, MHP_168_proteins_WP_011206356.1, MHP_232_proteins_WP_011206356.1, MHP_ES2L_proteins_WP_011206356.1, MHP_NCTC10127_proteins_WP_129640610.1, MHP_NCTC10127_proteins_WP_011206356.1, MFC_MF29_proteins_WP_011290238.1, MHP_168L_proteins_WP_011290238.1, MHP_168_proteins_WP_011290238.1, MHP_7422_proteins_WP_011290238.1, MHP_7448_proteins_WP_011290238.1, MHP_KM014_proteins_WP_011290238.1, MHP_UFV01_proteins_WP_011290238.1, MHP_UFV02_proteins_WP_011290238.1	MHP_11_proteins_WP_011206142.1, MHP_153B_proteins_WP_011206142.1, MHP_154B_proteins_WP_011206142.1, MHP_232_proteins_WP_011206142.1, MHP_98_proteins_WP_011206142.1, MHP_MHP694_proteins_WP_011206142.1, MHP_NCTC10127_proteins_WP_011206142.1, MHP_Ue273_proteins_WP_011206142.1, MHP_116_proteins_WP_348602800.1, MHP_131B_proteins_WP_404924450.1, MHP_133A_proteins_WP_404924450.1, MHP_LH_proteins_WP_233688725.1, MHP_1257_proteins_WP_348572080.1, MHP_4284_proteins_WP_348572080.1, MHP_168L_proteins_WP_011284063.1, MHP_168_proteins_WP_011284063.1, MHP_ES2_proteins_WP_011284063.1, MHP_J_proteins_WP_011284063.1, MHP_MHP653_proteins_WP_011284063.1, MHP_MHP682_proteins_WP_011284063.1, MHP_MHP691_proteins_WP_011284063.1, MHP_MHP699_proteins_WP_011284063.1, MHP_TB1_proteins_WP_011284063.1, MFC_MF29_proteins_WP_160581412.1
OG0000031	N2	n11	0.07142857142857142	Non-Terminal	MHP_11_proteins_WP_088172525.1, MHP_131B_proteins_WP_088172525.1, MHP_133A_proteins_WP_088172525.1, MHP_KM014_proteins_WP_088172525.1, MHP_MHP650_proteins_WP_088172525.1, MHP_MHP682_proteins_WP_088172525.1, MHP_MHP699_proteins_WP_088172525.1, MHP_111A_proteins_WP_404912416.1, MHP_112B_proteins_WP_404912416.1, MHP_153B_proteins_WP_404923928.1, MHP_154B_proteins_WP_404923928.1, MHP_98_proteins_WP_179695837.1, MHP_LH_proteins_WP_179695837.1, MHP_168L_proteins_WP_011206356.1, MHP_168_proteins_WP_011206356.1, MHP_232_proteins_WP_011206356.1, MHP_ES2L_proteins_WP_011206356.1, MHP_NCTC10127_proteins_WP_129640610.1, MHP_NCTC10127_proteins_WP_011206356.1	MFC_MF29_proteins_WP_011290238.1, MHP_168L_proteins_WP_011290238.1, MHP_168_proteins_WP_011290238.1, MHP_7422_proteins_WP_011290238.1, MHP_7448_proteins_WP_011290238.1, MHP_KM014_proteins_WP_011290238.1, MHP_UFV01_proteins_WP_011290238.1, MHP_UFV02_proteins_WP_011290238.1
OG0000031	MHP_NCTC10127_proteins	n21	1.0	Terminal	MHP_NCTC10127_proteins_WP_129640610.1	MHP_NCTC10127_proteins_WP_011206356.1
OG0000032	N0	n2	0.5	Non-Terminal	MFC_ATCC27716_proteins_WP_002557939.1, MFC_Ms42_proteins_WP_002557939.1, MHP_MHP679_proteins_WP_160590483.1, MHP_98_proteins_WP_258556530.1, MHP_Ue273_proteins_WP_347952309.1, MHP_MHP653_proteins_WP_258555922.1, MHP_116_proteins_WP_348602799.1, MHP_153B_proteins_WP_404924142.1, MHP_154B_proteins_WP_404924142.1, MHP_MHP650_proteins_WP_160601271.1, MHP_LH_proteins_WP_233688723.1, MHP_MHP696_proteins_WP_160588340.1, MHP_MHP709_proteins_WP_160588340.1, MHP_7422_proteins_WP_020835660.1, MHP_7448_proteins_WP_011290135.1, MHP_111A_proteins_WP_135618726.1, MHP_112B_proteins_WP_135618726.1, MHP_1257_proteins_WP_135618726.1, MHP_131B_proteins_WP_135618726.1, MHP_133A_proteins_WP_135618726.1, MHP_4284_proteins_WP_135618726.1, MHP_98_proteins_WP_135618726.1, MHP_ES2_proteins_WP_135618726.1, MHP_F72C_proteins_WP_135618726.1, MHP_MHP682_proteins_WP_135618726.1, MHP_MHP699_proteins_WP_135618726.1, MHP_ES2L_proteins_WP_179221091.1, MHP_Ue273_proteins_WP_347952438.1, MHP_Ue273_proteins_WP_347952437.1, MHP_MHP653_proteins_WP_308507034.1, MHP_MHP691_proteins_WP_160608068.1	MHP_ES2L_proteins_WP_240536621.1, MHP_1257_proteins_WP_348571862.1, MHP_MHP696_proteins_WP_308507060.1, MHP_MHP709_proteins_WP_308507099.1, MHP_MHP653_proteins_WP_308507003.1, MHP_MHP682_proteins_WP_308507003.1, MHP_MHP691_proteins_WP_308507003.1, MHP_MHP694_proteins_WP_308704608.1, MHP_7422_proteins_WP_236607959.1, MHP_Ue273_proteins_WP_347952310.1, MHP_MHP699_proteins_WP_308506987.1, MHP_112B_proteins_WP_404913680.1, MFC_ATCC27716_proteins_WP_231237886.1, MFC_Ms42_proteins_WP_231237886.1, MFC_MF33_proteins_WP_258556787.1, MHP_7448_proteins_WP_228366115.1, MHP_112B_proteins_WP_404913682.1, MHP_111A_proteins_WP_404912051.1, MHP_11_proteins_WP_232039557.1, MHP_232_proteins_WP_232039557.1, MHP_NCTC10127_proteins_WP_232039557.1, MHP_J_proteins_WP_237697219.1, MHP_MHP650_proteins_WP_308704765.1, MHP_ES2_proteins_WP_240536354.1, MHP_UFV01_proteins_WP_243215860.1, MHP_UFV02_proteins_WP_243215860.1, MHP_MHP679_proteins_WP_308704702.1, MHP_98_proteins_WP_258556526.1, MHP_131B_proteins_WP_404924322.1, MHP_133A_proteins_WP_404924322.1, MHP_168L_proteins_WP_014580002.1, MHP_168_proteins_WP_014580002.1, MHP_TB1_proteins_WP_252862131.1, MHP_11_proteins_WP_011206477.1, MHP_232_proteins_WP_011206477.1, MHP_NCTC10127_proteins_WP_011206477.1, MHP_LH_proteins_WP_233688556.1
OG0000032	N0	n6	0.022727272727272728	Non-Terminal	MHP_98_proteins_WP_258556530.1	MHP_Ue273_proteins_WP_347952309.1, MHP_MHP653_proteins_WP_258555922.1, MHP_116_proteins_WP_348602799.1, MHP_153B_proteins_WP_404924142.1, MHP_154B_proteins_WP_404924142.1, MHP_MHP650_proteins_WP_160601271.1, MHP_LH_proteins_WP_233688723.1, MHP_MHP696_proteins_WP_160588340.1, MHP_MHP709_proteins_WP_160588340.1, MHP_7422_proteins_WP_020835660.1, MHP_7448_proteins_WP_011290135.1, MHP_111A_proteins_WP_135618726.1, MHP_112B_proteins_WP_135618726.1, MHP_1257_proteins_WP_135618726.1, MHP_131B_proteins_WP_135618726.1, MHP_133A_proteins_WP_135618726.1, MHP_4284_proteins_WP_135618726.1, MHP_98_proteins_WP_135618726.1, MHP_ES2_proteins_WP_135618726.1, MHP_F72C_proteins_WP_135618726.1, MHP_MHP682_proteins_WP_135618726.1, MHP_MHP699_proteins_WP_135618726.1, MHP_ES2L_proteins_WP_179221091.1, MHP_Ue273_proteins_WP_347952438.1, MHP_Ue273_proteins_WP_347952437.1, MHP_MHP653_proteins_WP_308507034.1, MHP_MHP691_proteins_WP_160608068.1
OG0000032	N0	n7	0.022727272727272728	Non-Terminal	MHP_Ue273_proteins_WP_347952309.1	MHP_MHP653_proteins_WP_258555922.1, MHP_116_proteins_WP_348602799.1, MHP_153B_proteins_WP_404924142.1, MHP_154B_proteins_WP_404924142.1, MHP_MHP650_proteins_WP_160601271.1, MHP_LH_proteins_WP_233688723.1, MHP_MHP696_proteins_WP_160588340.1, MHP_MHP709_proteins_WP_160588340.1, MHP_7422_proteins_WP_020835660.1, MHP_7448_proteins_WP_011290135.1, MHP_111A_proteins_WP_135618726.1, MHP_112B_proteins_WP_135618726.1, MHP_1257_proteins_WP_135618726.1, MHP_131B_proteins_WP_135618726.1, MHP_133A_proteins_WP_135618726.1, MHP_4284_proteins_WP_135618726.1, MHP_98_proteins_WP_135618726.1, MHP_ES2_proteins_WP_135618726.1, MHP_F72C_proteins_WP_135618726.1, MHP_MHP682_proteins_WP_135618726.1, MHP_MHP699_proteins_WP_135618726.1, MHP_ES2L_proteins_WP_179221091.1, MHP_Ue273_proteins_WP_347952438.1, MHP_Ue273_proteins_WP_347952437.1, MHP_MHP653_proteins_WP_308507034.1, MHP_MHP691_proteins_WP_160608068.1
OG0000032	N0	n24	0.06818181818181818	Non-Terminal	MHP_ES2L_proteins_WP_240536621.1, MHP_1257_proteins_WP_348571862.1, MHP_MHP696_proteins_WP_308507060.1, MHP_MHP709_proteins_WP_308507099.1, MHP_MHP653_proteins_WP_308507003.1, MHP_MHP682_proteins_WP_308507003.1, MHP_MHP691_proteins_WP_308507003.1, MHP_MHP694_proteins_WP_308704608.1, MHP_7422_proteins_WP_236607959.1, MHP_Ue273_proteins_WP_347952310.1, MHP_MHP699_proteins_WP_308506987.1, MHP_112B_proteins_WP_404913680.1, MFC_ATCC27716_proteins_WP_231237886.1, MFC_Ms42_proteins_WP_231237886.1, MFC_MF33_proteins_WP_258556787.1, MHP_7448_proteins_WP_228366115.1, MHP_112B_proteins_WP_404913682.1, MHP_111A_proteins_WP_404912051.1, MHP_11_proteins_WP_232039557.1, MHP_232_proteins_WP_232039557.1, MHP_NCTC10127_proteins_WP_232039557.1, MHP_J_proteins_WP_237697219.1, MHP_MHP650_proteins_WP_308704765.1, MHP_ES2_proteins_WP_240536354.1, MHP_UFV01_proteins_WP_243215860.1, MHP_UFV02_proteins_WP_243215860.1, MHP_MHP679_proteins_WP_308704702.1, MHP_98_proteins_WP_258556526.1, MHP_131B_proteins_WP_404924322.1, MHP_133A_proteins_WP_404924322.1, MHP_168L_proteins_WP_014580002.1, MHP_168_proteins_WP_014580002.1, MHP_TB1_proteins_WP_252862131.1	MHP_11_proteins_WP_011206477.1, MHP_232_proteins_WP_011206477.1, MHP_NCTC10127_proteins_WP_011206477.1, MHP_LH_proteins_WP_233688556.1
OG0000032	N2	n36	0.023809523809523808	Non-Terminal	MHP_112B_proteins_WP_404913680.1	MFC_ATCC27716_proteins_WP_231237886.1, MFC_Ms42_proteins_WP_231237886.1, MFC_MF33_proteins_WP_258556787.1, MHP_7448_proteins_WP_228366115.1, MHP_112B_proteins_WP_404913682.1, MHP_111A_proteins_WP_404912051.1
OG0000033	N2	n2	0.047619047619047616	Non-Terminal	MHP_ES2_proteins_WP_240536334.1, MHP_MHP694_proteins_WP_308704607.1, MHP_J_proteins_WP_237697207.1, MHP_ES2_proteins_WP_240536336.1	MHP_UFV01_proteins_WP_243216218.1, MHP_UFV02_proteins_WP_243234984.1, MHP_LH_proteins_WP_233688456.1, MHP_168L_proteins_WP_016340229.1, MHP_168_proteins_WP_014579874.1, MHP_TB1_proteins_WP_252862173.1, MHP_TB1_proteins_WP_252862174.1, MHP_232_proteins_WP_011206280.1, MHP_11_proteins_WP_088172544.1, MHP_NCTC10127_proteins_WP_129640579.1, MHP_J_proteins_WP_011284201.1, MHP_ES2L_proteins_WP_240536604.1, MHP_ES2L_proteins_WP_240536605.1, MHP_111A_proteins_WP_404911880.1, MHP_112B_proteins_WP_404911880.1, MHP_MHP650_proteins_WP_160600708.1, MHP_F72C_proteins_WP_225972986.1, MHP_154B_proteins_WP_404924584.1, MHP_153B_proteins_WP_404923969.1, MHP_133A_proteins_WP_404924244.1, MHP_MHP691_proteins_WP_258555580.1, MHP_LH_proteins_WP_233688460.1, MHP_LH_proteins_WP_233688457.1, MFC_ATCC27716_proteins_WP_081605281.1, MFC_Ms42_proteins_WP_052234584.1, MFC_MF30_proteins_WP_160605396.1, MFC_MF29_proteins_WP_160580987.1, MFC_MF11_proteins_WP_160603107.1, MFC_MF29_proteins_WP_220200549.1, MFC_MF33_proteins_WP_160609298.1, MFC_MF22_proteins_WP_160583606.1, MFC_MF18_proteins_WP_160593403.1, MHP_ES2L_proteins_WP_240536603.1, MHP_MHP682_proteins_WP_160585780.1, MHP_MHP694_proteins_WP_308704605.1, MHP_153B_proteins_WP_404923967.1, MHP_154B_proteins_WP_404923967.1, MHP_Ue273_proteins_WP_347952234.1, MHP_7422_proteins_WP_020835778.1, MHP_7448_proteins_WP_044272519.1, MHP_MHP653_proteins_WP_160615728.1, MHP_MHP691_proteins_WP_258555581.1, MHP_MHP679_proteins_WP_308704710.1, MHP_F72C_proteins_WP_225972985.1, MHP_MHP699_proteins_WP_160585083.1, MHP_LH_proteins_WP_233688459.1, MHP_116_proteins_WP_348602537.1, MHP_1257_proteins_WP_348571723.1, MHP_111A_proteins_WP_404911875.1, MHP_112B_proteins_WP_404913638.1, MHP_131B_proteins_WP_404924517.1, MHP_133A_proteins_WP_404924241.1, MHP_4284_proteins_WP_406823123.1, MHP_153B_proteins_WP_404923968.1, MHP_154B_proteins_WP_404924582.1, MHP_133A_proteins_WP_404924242.1, MHP_131B_proteins_WP_404924520.1, MHP_131B_proteins_WP_404924518.1, MHP_111A_proteins_WP_404911876.1, MHP_112B_proteins_WP_404911876.1
OG0000033	N8	n3	0.037037037037037035	Non-Terminal	MHP_ES2_proteins_WP_240536334.1, MHP_MHP694_proteins_WP_308704607.1	MHP_J_proteins_WP_237697207.1, MHP_ES2_proteins_WP_240536336.1
OG0000033	N2	n6	0.047619047619047616	Non-Terminal	MHP_UFV01_proteins_WP_243216218.1, MHP_UFV02_proteins_WP_243234984.1, MHP_LH_proteins_WP_233688456.1, MHP_168L_proteins_WP_016340229.1, MHP_168_proteins_WP_014579874.1, MHP_TB1_proteins_WP_252862173.1, MHP_TB1_proteins_WP_252862174.1, MHP_232_proteins_WP_011206280.1, MHP_11_proteins_WP_088172544.1, MHP_NCTC10127_proteins_WP_129640579.1, MHP_J_proteins_WP_011284201.1, MHP_ES2L_proteins_WP_240536604.1, MHP_ES2L_proteins_WP_240536605.1	MHP_111A_proteins_WP_404911880.1, MHP_112B_proteins_WP_404911880.1, MHP_MHP650_proteins_WP_160600708.1, MHP_F72C_proteins_WP_225972986.1, MHP_154B_proteins_WP_404924584.1, MHP_153B_proteins_WP_404923969.1, MHP_133A_proteins_WP_404924244.1, MHP_MHP691_proteins_WP_258555580.1, MHP_LH_proteins_WP_233688460.1, MHP_LH_proteins_WP_233688457.1, MFC_ATCC27716_proteins_WP_081605281.1, MFC_Ms42_proteins_WP_052234584.1, MFC_MF30_proteins_WP_160605396.1, MFC_MF29_proteins_WP_160580987.1, MFC_MF11_proteins_WP_160603107.1, MFC_MF29_proteins_WP_220200549.1, MFC_MF33_proteins_WP_160609298.1, MFC_MF22_proteins_WP_160583606.1, MFC_MF18_proteins_WP_160593403.1, MHP_ES2L_proteins_WP_240536603.1, MHP_MHP682_proteins_WP_160585780.1, MHP_MHP694_proteins_WP_308704605.1, MHP_153B_proteins_WP_404923967.1, MHP_154B_proteins_WP_404923967.1, MHP_Ue273_proteins_WP_347952234.1, MHP_7422_proteins_WP_020835778.1, MHP_7448_proteins_WP_044272519.1, MHP_MHP653_proteins_WP_160615728.1, MHP_MHP691_proteins_WP_258555581.1, MHP_MHP679_proteins_WP_308704710.1, MHP_F72C_proteins_WP_225972985.1, MHP_MHP699_proteins_WP_160585083.1, MHP_LH_proteins_WP_233688459.1, MHP_116_proteins_WP_348602537.1, MHP_1257_proteins_WP_348571723.1, MHP_111A_proteins_WP_404911875.1, MHP_112B_proteins_WP_404913638.1, MHP_131B_proteins_WP_404924517.1, MHP_133A_proteins_WP_404924241.1, MHP_4284_proteins_WP_406823123.1, MHP_153B_proteins_WP_404923968.1, MHP_154B_proteins_WP_404924582.1, MHP_133A_proteins_WP_404924242.1, MHP_131B_proteins_WP_404924520.1, MHP_131B_proteins_WP_404924518.1, MHP_111A_proteins_WP_404911876.1, MHP_112B_proteins_WP_404911876.1
OG0000033	MHP_TB1_proteins	n13	1.0	Terminal	MHP_TB1_proteins_WP_252862173.1	MHP_TB1_proteins_WP_252862174.1
OG0000033	MHP_ES2L_proteins	n18	1.0	Terminal	MHP_ES2L_proteins_WP_240536604.1	MHP_ES2L_proteins_WP_240536605.1
OG0000033	N2	n19	0.19047619047619047	Non-Terminal	MHP_111A_proteins_WP_404911880.1, MHP_112B_proteins_WP_404911880.1, MHP_MHP650_proteins_WP_160600708.1, MHP_F72C_proteins_WP_225972986.1, MHP_154B_proteins_WP_404924584.1, MHP_153B_proteins_WP_404923969.1, MHP_133A_proteins_WP_404924244.1, MHP_MHP691_proteins_WP_258555580.1, MHP_LH_proteins_WP_233688460.1, MHP_LH_proteins_WP_233688457.1, MFC_ATCC27716_proteins_WP_081605281.1, MFC_Ms42_proteins_WP_052234584.1, MFC_MF30_proteins_WP_160605396.1, MFC_MF29_proteins_WP_160580987.1, MFC_MF11_proteins_WP_160603107.1, MFC_MF29_proteins_WP_220200549.1, MFC_MF33_proteins_WP_160609298.1, MFC_MF22_proteins_WP_160583606.1, MFC_MF18_proteins_WP_160593403.1	MHP_ES2L_proteins_WP_240536603.1, MHP_MHP682_proteins_WP_160585780.1, MHP_MHP694_proteins_WP_308704605.1, MHP_153B_proteins_WP_404923967.1, MHP_154B_proteins_WP_404923967.1, MHP_Ue273_proteins_WP_347952234.1, MHP_7422_proteins_WP_020835778.1, MHP_7448_proteins_WP_044272519.1, MHP_MHP653_proteins_WP_160615728.1, MHP_MHP691_proteins_WP_258555581.1, MHP_MHP679_proteins_WP_308704710.1, MHP_F72C_proteins_WP_225972985.1, MHP_MHP699_proteins_WP_160585083.1, MHP_LH_proteins_WP_233688459.1, MHP_116_proteins_WP_348602537.1, MHP_1257_proteins_WP_348571723.1, MHP_111A_proteins_WP_404911875.1, MHP_112B_proteins_WP_404913638.1, MHP_131B_proteins_WP_404924517.1, MHP_133A_proteins_WP_404924241.1, MHP_4284_proteins_WP_406823123.1, MHP_153B_proteins_WP_404923968.1, MHP_154B_proteins_WP_404924582.1, MHP_133A_proteins_WP_404924242.1, MHP_131B_proteins_WP_404924520.1, MHP_131B_proteins_WP_404924518.1, MHP_111A_proteins_WP_404911876.1, MHP_112B_proteins_WP_404911876.1
